[
  {
    "id": 3,
    "name": "Общий чат",
    "description": "",
    "status": {
      "id": 2,
      "name": "В работе",
      "color": "#3377C3",
      "isActive": true,
      "hasDeadline": true,
      "isAppliedIndividually": false,
      "texts": [
        {
          "lang": "Ru",
          "name": "В работе"
        },
        {
          "lang": "En",
          "name": "In progress"
        }
      ]
    },
    "assigner": {
      "id": "user:2",
      "name": "ПланФикс"
    }
  },
  {
    "id": 16,
    "name": "Бишкек. Маркетинг",
    "description": "",
    "status": {
      "id": 2,
      "name": "В работе",
      "color": "#3377C3",
      "isActive": true,
      "hasDeadline": true,
      "isAppliedIndividually": false,
      "texts": [
        {
          "lang": "Ru",
          "name": "В работе"
        },
        {
          "lang": "En",
          "name": "In progress"
        }
      ]
    },
    "assigner": {
      "id": "user:3",
      "name": "Вячеслав Фоменко"
    },
    "project": {
      "id": 116,
      "name": "Маркетинг"
    },
    "assignees": {
      "users": [
        {
          "id": "user:3",
          "name": "Вячеслав Фоменко"
        }
      ],
      "groups": []
    }
  },
  {
    "id": 26,
    "name": "Подготовить юридическую модель компаний для Киргизии",
    "description": "<p>Наша задача выстроить починенность компаний и создать организационную схему компаний.</p>",
    "status": {
      "id": 2,
      "name": "В работе",
      "color": "#3377C3",
      "isActive": true,
      "hasDeadline": true,
      "isAppliedIndividually": false,
      "texts": [
        {
          "lang": "Ru",
          "name": "В работе"
        },
        {
          "lang": "En",
          "name": "In progress"
        }
      ]
    },
    "assigner": {
      "id": "user:5",
      "name": "Алексей Шульга"
    },
    "project": {
      "id": 23,
      "name": "Общие вопросы компании"
    },
    "startDateTime": {
      "date": "20-02-2025",
      "time": "00:00",
      "datetime": "2025-02-20T00:00Z"
    },
    "endDateTime": {
      "date": "30-05-2025",
      "time": "00:00",
      "datetime": "2025-05-30T00:00Z"
    },
    "assignees": {
      "users": [
        {
          "id": "user:5",
          "name": "Алексей Шульга"
        },
        {
          "id": "user:1",
          "name": "Константин Осипов"
        }
      ],
      "groups": []
    }
  },
  {
    "id": 32,
    "name": "Заключить договор ГЧК",
    "description": "",
    "status": {
      "id": 2,
      "name": "В работе",
      "color": "#3377C3",
      "isActive": true,
      "hasDeadline": true,
      "isAppliedIndividually": false,
      "texts": [
        {
          "lang": "Ru",
          "name": "В работе"
        },
        {
          "lang": "En",
          "name": "In progress"
        }
      ]
    },
    "assigner": {
      "id": "user:5",
      "name": "Алексей Шульга"
    },
    "project": {
      "id": 12,
      "name": "Polaris Иссык-Куль"
    },
    "assignees": {
      "users": [
        {
          "id": "user:4",
          "name": "Назарий Шевченко"
        }
      ],
      "groups": []
    }
  },
  {
    "id": 33,
    "name": "Создать юридическую схему реализации проекта",
    "description": "",
    "status": {
      "id": 2,
      "name": "В работе",
      "color": "#3377C3",
      "isActive": true,
      "hasDeadline": true,
      "isAppliedIndividually": false,
      "texts": [
        {
          "lang": "Ru",
          "name": "В работе"
        },
        {
          "lang": "En",
          "name": "In progress"
        }
      ]
    },
    "assigner": {
      "id": "user:5",
      "name": "Алексей Шульга"
    },
    "project": {
      "id": 12,
      "name": "Polaris Иссык-Куль"
    },
    "startDateTime": {
      "date": "22-01-2025",
      "time": "00:00",
      "datetime": "2025-01-22T00:00Z"
    },
    "endDateTime": {
      "date": "23-05-2025",
      "time": "00:00",
      "datetime": "2025-05-23T00:00Z"
    },
    "assignees": {
      "users": [
        {
          "id": "user:4",
          "name": "Назарий Шевченко"
        }
      ],
      "groups": []
    }
  },
  {
    "id": 34,
    "name": "Схема продажи объектов недвижимости Полярис",
    "description": "",
    "status": {
      "id": 2,
      "name": "В работе",
      "color": "#3377C3",
      "isActive": true,
      "hasDeadline": true,
      "isAppliedIndividually": false,
      "texts": [
        {
          "lang": "Ru",
          "name": "В работе"
        },
        {
          "lang": "En",
          "name": "In progress"
        }
      ]
    },
    "assigner": {
      "id": "user:5",
      "name": "Алексей Шульга"
    },
    "project": {
      "id": 12,
      "name": "Polaris Иссык-Куль"
    },
    "startDateTime": {
      "date": "22-01-2025",
      "time": "00:00",
      "datetime": "2025-01-22T00:00Z"
    },
    "endDateTime": {
      "date": "15-05-2025",
      "time": "00:00",
      "datetime": "2025-05-15T00:00Z"
    },
    "assignees": {
      "users": [
        {
          "id": "user:4",
          "name": "Назарий Шевченко"
        }
      ],
      "groups": []
    }
  },
  {
    "id": 35,
    "name": "Налоговая схема реализации проекта Полярис",
    "description": "",
    "status": {
      "id": 2,
      "name": "В работе",
      "color": "#3377C3",
      "isActive": true,
      "hasDeadline": true,
      "isAppliedIndividually": false,
      "texts": [
        {
          "lang": "Ru",
          "name": "В работе"
        },
        {
          "lang": "En",
          "name": "In progress"
        }
      ]
    },
    "assigner": {
      "id": "user:5",
      "name": "Алексей Шульга"
    },
    "project": {
      "id": 12,
      "name": "Polaris Иссык-Куль"
    },
    "startDateTime": {
      "date": "22-01-2025",
      "time": "00:00",
      "datetime": "2025-01-22T00:00Z"
    },
    "endDateTime": {
      "date": "23-05-2025",
      "time": "00:00",
      "datetime": "2025-05-23T00:00Z"
    },
    "assignees": {
      "users": [
        {
          "id": "user:4",
          "name": "Назарий Шевченко"
        }
      ],
      "groups": []
    }
  },
  {
    "id": 37,
    "name": "Создать юридическую схему финансирования и получения прибыли",
    "description": "",
    "status": {
      "id": 2,
      "name": "В работе",
      "color": "#3377C3",
      "isActive": true,
      "hasDeadline": true,
      "isAppliedIndividually": false,
      "texts": [
        {
          "lang": "Ru",
          "name": "В работе"
        },
        {
          "lang": "En",
          "name": "In progress"
        }
      ]
    },
    "assigner": {
      "id": "user:5",
      "name": "Алексей Шульга"
    },
    "project": {
      "id": 12,
      "name": "Polaris Иссык-Куль"
    },
    "startDateTime": {
      "date": "22-01-2025",
      "time": "00:00",
      "datetime": "2025-01-22T00:00Z"
    },
    "endDateTime": {
      "date": "22-05-2025",
      "time": "00:00",
      "datetime": "2025-05-22T00:00Z"
    },
    "assignees": {
      "users": [
        {
          "id": "user:4",
          "name": "Назарий Шевченко"
        }
      ],
      "groups": []
    }
  },
  {
    "id": 38,
    "name": "Заключить договора с необходимыми подрядными организациями",
    "description": "",
    "status": {
      "id": 2,
      "name": "В работе",
      "color": "#3377C3",
      "isActive": true,
      "hasDeadline": true,
      "isAppliedIndividually": false,
      "texts": [
        {
          "lang": "Ru",
          "name": "В работе"
        },
        {
          "lang": "En",
          "name": "In progress"
        }
      ]
    },
    "assigner": {
      "id": "user:5",
      "name": "Алексей Шульга"
    },
    "project": {
      "id": 12,
      "name": "Polaris Иссык-Куль"
    },
    "startDateTime": {
      "date": "21-01-2025",
      "time": "00:00",
      "datetime": "2025-01-21T00:00Z"
    },
    "endDateTime": {
      "date": "16-05-2025",
      "time": "00:00",
      "datetime": "2025-05-16T00:00Z"
    },
    "assignees": {
      "users": [
        {
          "id": "user:4",
          "name": "Назарий Шевченко"
        }
      ],
      "groups": []
    }
  },
  {
    "id": 40,
    "name": "Заключить договор с компанией занимающейся безопасностью бизнеса",
    "description": "",
    "status": {
      "id": 2,
      "name": "В работе",
      "color": "#3377C3",
      "isActive": true,
      "hasDeadline": true,
      "isAppliedIndividually": false,
      "texts": [
        {
          "lang": "Ru",
          "name": "В работе"
        },
        {
          "lang": "En",
          "name": "In progress"
        }
      ]
    },
    "assigner": {
      "id": "user:5",
      "name": "Алексей Шульга"
    },
    "project": {
      "id": 12,
      "name": "Polaris Иссык-Куль"
    },
    "startDateTime": {
      "date": "23-01-2025",
      "time": "00:00",
      "datetime": "2025-01-23T00:00Z"
    },
    "endDateTime": {
      "date": "16-05-2025",
      "time": "00:00",
      "datetime": "2025-05-16T00:00Z"
    },
    "assignees": {
      "users": [
        {
          "id": "user:1",
          "name": "Константин Осипов"
        },
        {
          "id": "user:4",
          "name": "Назарий Шевченко"
        }
      ],
      "groups": []
    }
  },
  {
    "id": 43,
    "name": "Составить список потенциальных подрядчиков маркетинговых агенств",
    "description": "<p>Нам нужно будет под 4 проекта подрядчик по диджитал маркетингу, но и не только, важно чтобы у них было понимание общего маркетинга тоже.</p><p>Нам не важно их территориальное нахождение.</p><p>Слава напиши что тебе важно у такого подрядчика и давайте уже подбирать.</p>",
    "status": {
      "id": 2,
      "name": "В работе",
      "color": "#3377C3",
      "isActive": true,
      "hasDeadline": true,
      "isAppliedIndividually": false,
      "texts": [
        {
          "lang": "Ru",
          "name": "В работе"
        },
        {
          "lang": "En",
          "name": "In progress"
        }
      ]
    },
    "assigner": {
      "id": "user:5",
      "name": "Алексей Шульга"
    },
    "project": {
      "id": 12,
      "name": "Polaris Иссык-Куль"
    },
    "startDateTime": {
      "date": "22-01-2025",
      "time": "00:00",
      "datetime": "2025-01-22T00:00Z"
    },
    "endDateTime": {
      "date": "12-05-2025",
      "time": "00:00",
      "datetime": "2025-05-12T00:00Z"
    },
    "assignees": {
      "users": [
        {
          "id": "user:3",
          "name": "Вячеслав Фоменко"
        },
        {
          "id": "user:4",
          "name": "Назарий Шевченко"
        }
      ],
      "groups": []
    }
  },
  {
    "id": 46,
    "name": "Бизнес-процесы и инструкции",
    "description": "",
    "status": {
      "id": 2,
      "name": "В работе",
      "color": "#3377C3",
      "isActive": true,
      "hasDeadline": true,
      "isAppliedIndividually": false,
      "texts": [
        {
          "lang": "Ru",
          "name": "В работе"
        },
        {
          "lang": "En",
          "name": "In progress"
        }
      ]
    },
    "assigner": {
      "id": "user:5",
      "name": "Алексей Шульга"
    },
    "project": {
      "id": 23,
      "name": "Общие вопросы компании"
    }
  },
  {
    "id": 47,
    "name": "Движение денежных средств",
    "description": "",
    "status": {
      "id": 0,
      "name": "Черновик",
      "color": "#3D3F46",
      "isActive": false,
      "hasDeadline": false,
      "isAppliedIndividually": false,
      "texts": [
        {
          "lang": "Ru",
          "name": "Черновик"
        },
        {
          "lang": "En",
          "name": "Draft"
        }
      ]
    },
    "assigner": {
      "id": "user:5",
      "name": "Алексей Шульга"
    },
    "project": {
      "id": 23,
      "name": "Общие вопросы компании"
    }
  },
  {
    "id": 48,
    "name": "Согласование договоров",
    "description": "",
    "status": {
      "id": 0,
      "name": "Черновик",
      "color": "#3D3F46",
      "isActive": false,
      "hasDeadline": false,
      "isAppliedIndividually": false,
      "texts": [
        {
          "lang": "Ru",
          "name": "Черновик"
        },
        {
          "lang": "En",
          "name": "Draft"
        }
      ]
    },
    "assigner": {
      "id": "user:5",
      "name": "Алексей Шульга"
    },
    "project": {
      "id": 23,
      "name": "Общие вопросы компании"
    }
  },
  {
    "id": 50,
    "name": "Согласованое бюджетов и планов",
    "description": "",
    "status": {
      "id": 0,
      "name": "Черновик",
      "color": "#3D3F46",
      "isActive": false,
      "hasDeadline": false,
      "isAppliedIndividually": false,
      "texts": [
        {
          "lang": "Ru",
          "name": "Черновик"
        },
        {
          "lang": "En",
          "name": "Draft"
        }
      ]
    },
    "assigner": {
      "id": "user:5",
      "name": "Алексей Шульга"
    },
    "project": {
      "id": 23,
      "name": "Общие вопросы компании"
    }
  },
  {
    "id": 51,
    "name": "Создание других необходимых бизнес процессов",
    "description": "",
    "status": {
      "id": 0,
      "name": "Черновик",
      "color": "#3D3F46",
      "isActive": false,
      "hasDeadline": false,
      "isAppliedIndividually": false,
      "texts": [
        {
          "lang": "Ru",
          "name": "Черновик"
        },
        {
          "lang": "En",
          "name": "Draft"
        }
      ]
    },
    "assigner": {
      "id": "user:5",
      "name": "Алексей Шульга"
    },
    "project": {
      "id": 23,
      "name": "Общие вопросы компании"
    }
  },
  {
    "id": 52,
    "name": "Концепция/Маркетинг",
    "description": "",
    "status": {
      "id": 2,
      "name": "В работе",
      "color": "#3377C3",
      "isActive": true,
      "hasDeadline": true,
      "isAppliedIndividually": false,
      "texts": [
        {
          "lang": "Ru",
          "name": "В работе"
        },
        {
          "lang": "En",
          "name": "In progress"
        }
      ]
    },
    "assigner": {
      "id": "user:5",
      "name": "Алексей Шульга"
    },
    "project": {
      "id": 12,
      "name": "Polaris Иссык-Куль"
    },
    "assignees": {
      "users": [
        {
          "id": "user:4",
          "name": "Назарий Шевченко"
        }
      ],
      "groups": []
    }
  },
  {
    "id": 53,
    "name": "Проектирование",
    "description": "",
    "status": {
      "id": 2,
      "name": "В работе",
      "color": "#3377C3",
      "isActive": true,
      "hasDeadline": true,
      "isAppliedIndividually": false,
      "texts": [
        {
          "lang": "Ru",
          "name": "В работе"
        },
        {
          "lang": "En",
          "name": "In progress"
        }
      ]
    },
    "assigner": {
      "id": "user:5",
      "name": "Алексей Шульга"
    },
    "project": {
      "id": 12,
      "name": "Polaris Иссык-Куль"
    },
    "assignees": {
      "users": [
        {
          "id": "user:4",
          "name": "Назарий Шевченко"
        }
      ],
      "groups": []
    }
  },
  {
    "id": 55,
    "name": "Разработать детальную текстовую концепцию проекта",
    "description": "",
    "status": {
      "id": 2,
      "name": "В работе",
      "color": "#3377C3",
      "isActive": true,
      "hasDeadline": true,
      "isAppliedIndividually": false,
      "texts": [
        {
          "lang": "Ru",
          "name": "В работе"
        },
        {
          "lang": "En",
          "name": "In progress"
        }
      ]
    },
    "assigner": {
      "id": "user:5",
      "name": "Алексей Шульга"
    },
    "project": {
      "id": 12,
      "name": "Polaris Иссык-Куль"
    },
    "startDateTime": {
      "date": "22-01-2025",
      "time": "00:00",
      "datetime": "2025-01-22T00:00Z"
    },
    "endDateTime": {
      "date": "10-05-2025",
      "time": "00:00",
      "datetime": "2025-05-10T00:00Z"
    },
    "assignees": {
      "users": [
        {
          "id": "user:5",
          "name": "Алексей Шульга"
        },
        {
          "id": "user:1",
          "name": "Константин Осипов"
        },
        {
          "id": "user:4",
          "name": "Назарий Шевченко"
        }
      ],
      "groups": []
    }
  },
  {
    "id": 57,
    "name": "Эскиз",
    "description": "",
    "status": {
      "id": 2,
      "name": "В работе",
      "color": "#3377C3",
      "isActive": true,
      "hasDeadline": true,
      "isAppliedIndividually": false,
      "texts": [
        {
          "lang": "Ru",
          "name": "В работе"
        },
        {
          "lang": "En",
          "name": "In progress"
        }
      ]
    },
    "assigner": {
      "id": "user:5",
      "name": "Алексей Шульга"
    },
    "project": {
      "id": 12,
      "name": "Polaris Иссык-Куль"
    },
    "assignees": {
      "users": [
        {
          "id": "user:4",
          "name": "Назарий Шевченко"
        }
      ],
      "groups": []
    }
  },
  {
    "id": 58,
    "name": "Стадия П",
    "description": "",
    "status": {
      "id": 2,
      "name": "В работе",
      "color": "#3377C3",
      "isActive": true,
      "hasDeadline": true,
      "isAppliedIndividually": false,
      "texts": [
        {
          "lang": "Ru",
          "name": "В работе"
        },
        {
          "lang": "En",
          "name": "In progress"
        }
      ]
    },
    "assigner": {
      "id": "user:5",
      "name": "Алексей Шульга"
    },
    "project": {
      "id": 12,
      "name": "Polaris Иссык-Куль"
    },
    "assignees": {
      "users": [
        {
          "id": "user:4",
          "name": "Назарий Шевченко"
        }
      ],
      "groups": []
    }
  },
  {
    "id": 59,
    "name": "РНС",
    "description": "",
    "status": {
      "id": 2,
      "name": "В работе",
      "color": "#3377C3",
      "isActive": true,
      "hasDeadline": true,
      "isAppliedIndividually": false,
      "texts": [
        {
          "lang": "Ru",
          "name": "В работе"
        },
        {
          "lang": "En",
          "name": "In progress"
        }
      ]
    },
    "assigner": {
      "id": "user:5",
      "name": "Алексей Шульга"
    },
    "project": {
      "id": 12,
      "name": "Polaris Иссык-Куль"
    },
    "assignees": {
      "users": [
        {
          "id": "user:4",
          "name": "Назарий Шевченко"
        }
      ],
      "groups": []
    }
  },
  {
    "id": 60,
    "name": "Экспертиза",
    "description": "",
    "status": {
      "id": 2,
      "name": "В работе",
      "color": "#3377C3",
      "isActive": true,
      "hasDeadline": true,
      "isAppliedIndividually": false,
      "texts": [
        {
          "lang": "Ru",
          "name": "В работе"
        },
        {
          "lang": "En",
          "name": "In progress"
        }
      ]
    },
    "assigner": {
      "id": "user:5",
      "name": "Алексей Шульга"
    },
    "project": {
      "id": 12,
      "name": "Polaris Иссык-Куль"
    },
    "assignees": {
      "users": [
        {
          "id": "user:4",
          "name": "Назарий Шевченко"
        }
      ],
      "groups": []
    }
  },
  {
    "id": 61,
    "name": "Утвердить ТЭПы, получить градусловия нужные нам",
    "description": "",
    "status": {
      "id": 2,
      "name": "В работе",
      "color": "#3377C3",
      "isActive": true,
      "hasDeadline": true,
      "isAppliedIndividually": false,
      "texts": [
        {
          "lang": "Ru",
          "name": "В работе"
        },
        {
          "lang": "En",
          "name": "In progress"
        }
      ]
    },
    "assigner": {
      "id": "user:5",
      "name": "Алексей Шульга"
    },
    "project": {
      "id": 12,
      "name": "Polaris Иссык-Куль"
    },
    "assignees": {
      "users": [
        {
          "id": "user:4",
          "name": "Назарий Шевченко"
        }
      ],
      "groups": []
    }
  },
  {
    "id": 74,
    "name": "Снести здания на участке проекта Elysium",
    "description": "",
    "status": {
      "id": 2,
      "name": "В работе",
      "color": "#3377C3",
      "isActive": true,
      "hasDeadline": true,
      "isAppliedIndividually": false,
      "texts": [
        {
          "lang": "Ru",
          "name": "В работе"
        },
        {
          "lang": "En",
          "name": "In progress"
        }
      ]
    },
    "assigner": {
      "id": "user:5",
      "name": "Алексей Шульга"
    },
    "project": {
      "id": 1647,
      "name": "Elysium Иссык-Куль"
    },
    "endDateTime": {
      "date": "16-05-2025",
      "time": "00:00",
      "datetime": "2025-05-16T00:00Z"
    }
  },
  {
    "id": 93,
    "name": "Изучить возможность таргетинга рилсов на Кыргызстан. (и других видов рекламы)",
    "description": "<p>Назар, наша задача понять какие наиболее эффективные каналы продаж в Кыргызстане. Подумай.</p>",
    "status": {
      "id": 2,
      "name": "В работе",
      "color": "#3377C3",
      "isActive": true,
      "hasDeadline": true,
      "isAppliedIndividually": false,
      "texts": [
        {
          "lang": "Ru",
          "name": "В работе"
        },
        {
          "lang": "En",
          "name": "In progress"
        }
      ]
    },
    "assigner": {
      "id": "user:1",
      "name": "Константин Осипов"
    },
    "project": {
      "id": 116,
      "name": "Маркетинг"
    },
    "assignees": {
      "users": [
        {
          "id": "user:4",
          "name": "Назарий Шевченко"
        }
      ],
      "groups": []
    }
  },
  {
    "id": 103,
    "name": "Подготовить текстовую концепцию проекта Иллизиум",
    "description": "",
    "status": {
      "id": 2,
      "name": "В работе",
      "color": "#3377C3",
      "isActive": true,
      "hasDeadline": true,
      "isAppliedIndividually": false,
      "texts": [
        {
          "lang": "Ru",
          "name": "В работе"
        },
        {
          "lang": "En",
          "name": "In progress"
        }
      ]
    },
    "assigner": {
      "id": "user:5",
      "name": "Алексей Шульга"
    },
    "project": {
      "id": 1647,
      "name": "Elysium Иссык-Куль"
    },
    "startDateTime": {
      "date": "31-01-2025",
      "time": "00:00",
      "datetime": "2025-01-31T00:00Z"
    },
    "endDateTime": {
      "date": "10-05-2025",
      "time": "00:00",
      "datetime": "2025-05-10T00:00Z"
    },
    "assignees": {
      "users": [
        {
          "id": "user:3",
          "name": "Вячеслав Фоменко"
        },
        {
          "id": "user:5",
          "name": "Алексей Шульга"
        },
        {
          "id": "user:1",
          "name": "Константин Осипов"
        }
      ],
      "groups": []
    }
  },
  {
    "id": 104,
    "name": "Провести тендер на концепцию Elysium",
    "description": "",
    "status": {
      "id": 2,
      "name": "В работе",
      "color": "#3377C3",
      "isActive": true,
      "hasDeadline": true,
      "isAppliedIndividually": false,
      "texts": [
        {
          "lang": "Ru",
          "name": "В работе"
        },
        {
          "lang": "En",
          "name": "In progress"
        }
      ]
    },
    "assigner": {
      "id": "user:1",
      "name": "Константин Осипов"
    },
    "project": {
      "id": 1647,
      "name": "Elysium Иссык-Куль"
    },
    "startDateTime": {
      "date": "10-03-2025",
      "time": "00:00",
      "datetime": "2025-03-10T00:00Z"
    },
    "endDateTime": {
      "date": "12-05-2025",
      "time": "00:00",
      "datetime": "2025-05-12T00:00Z"
    },
    "assignees": {
      "users": [
        {
          "id": "user:5",
          "name": "Алексей Шульга"
        },
        {
          "id": "user:1",
          "name": "Константин Осипов"
        },
        {
          "id": "user:4",
          "name": "Назарий Шевченко"
        },
        {
          "id": "user:6",
          "name": "Марлен Замиров"
        }
      ],
      "groups": []
    }
  },
  {
    "id": 175,
    "name": "Утвердить площадки под Тазалыки. Сделать ТЗ. МЭРИЯ!!!",
    "description": "<p>ВАЖНО!!! Согласовать эту идею с Андреем и с Алексеем.<br />За это отвественный - Шульга Алексей.<br /><br />Мерия - до момента подписания Договора</p>",
    "status": {
      "id": 2,
      "name": "В работе",
      "color": "#3377C3",
      "isActive": true,
      "hasDeadline": true,
      "isAppliedIndividually": false,
      "texts": [
        {
          "lang": "Ru",
          "name": "В работе"
        },
        {
          "lang": "En",
          "name": "In progress"
        }
      ]
    },
    "assigner": {
      "id": "user:5",
      "name": "Алексей Шульга"
    },
    "project": {
      "id": 1310,
      "name": "Строительство Тазалыка №1"
    },
    "startDateTime": {
      "date": "06-02-2025",
      "time": "00:00",
      "datetime": "2025-02-06T00:00Z"
    },
    "endDateTime": {
      "date": "02-05-2025",
      "time": "00:00",
      "datetime": "2025-05-02T00:00Z"
    },
    "assignees": {
      "users": [
        {
          "id": "user:5",
          "name": "Алексей Шульга"
        },
        {
          "id": "user:7",
          "name": "Оксана Янковская"
        }
      ],
      "groups": []
    }
  },
  {
    "id": 180,
    "name": "Внесение правок в Планфикс",
    "description": "",
    "status": {
      "id": 2,
      "name": "В работе",
      "color": "#3377C3",
      "isActive": true,
      "hasDeadline": true,
      "isAppliedIndividually": false,
      "texts": [
        {
          "lang": "Ru",
          "name": "В работе"
        },
        {
          "lang": "En",
          "name": "In progress"
        }
      ]
    },
    "assigner": {
      "id": "user:5",
      "name": "Алексей Шульга"
    },
    "project": {
      "id": 23,
      "name": "Общие вопросы компании"
    },
    "assignees": {
      "users": [
        {
          "id": "user:3",
          "name": "Вячеслав Фоменко"
        },
        {
          "id": "user:9",
          "name": "Бахтияр Ибрагимов"
        }
      ],
      "groups": []
    }
  },
  {
    "id": 192,
    "name": "Внести регламент с Назаром по ведению баз данных",
    "description": "",
    "status": {
      "id": 1,
      "name": "Новая",
      "color": "#00b4b4",
      "isActive": true,
      "hasDeadline": true,
      "isAppliedIndividually": false,
      "texts": [
        {
          "lang": "Ru",
          "name": "Новая"
        },
        {
          "lang": "En",
          "name": "New"
        }
      ]
    },
    "assigner": {
      "id": "user:5",
      "name": "Алексей Шульга"
    }
  },
  {
    "id": 201,
    "name": "Операторы+Арендаторы+Партнёры",
    "description": "",
    "status": {
      "id": 2,
      "name": "В работе",
      "color": "#3377C3",
      "isActive": true,
      "hasDeadline": true,
      "isAppliedIndividually": false,
      "texts": [
        {
          "lang": "Ru",
          "name": "В работе"
        },
        {
          "lang": "En",
          "name": "In progress"
        }
      ]
    },
    "assigner": {
      "id": "user:5",
      "name": "Алексей Шульга"
    },
    "project": {
      "id": 12,
      "name": "Polaris Иссык-Куль"
    }
  },
  {
    "id": 202,
    "name": "Найти оператора отеля. Polaris+Ellusion",
    "description": "<p>Нужен оператор на 4-х звёздочный отель</p>",
    "status": {
      "id": 2,
      "name": "В работе",
      "color": "#3377C3",
      "isActive": true,
      "hasDeadline": true,
      "isAppliedIndividually": false,
      "texts": [
        {
          "lang": "Ru",
          "name": "В работе"
        },
        {
          "lang": "En",
          "name": "In progress"
        }
      ]
    },
    "assigner": {
      "id": "user:5",
      "name": "Алексей Шульга"
    },
    "project": {
      "id": 12,
      "name": "Polaris Иссык-Куль"
    },
    "startDateTime": {
      "date": "04-02-2025",
      "time": "00:00",
      "datetime": "2025-02-04T00:00Z"
    },
    "endDateTime": {
      "date": "22-05-2025",
      "time": "00:00",
      "datetime": "2025-05-22T00:00Z"
    },
    "assignees": {
      "users": [
        {
          "id": "user:5",
          "name": "Алексей Шульга"
        },
        {
          "id": "user:1",
          "name": "Константин Осипов"
        },
        {
          "id": "user:4",
          "name": "Назарий Шевченко"
        }
      ],
      "groups": []
    }
  },
  {
    "id": 203,
    "name": "Заключить Договор с тур-оператором",
    "description": "<p>Есть контакт Бектура. Который ведущий тур-оператор в Кыргыстане. Цель - заключить с ним договор о сотрудничестве в разрезе организации корпоративных туров и тренингов в нашем отеле</p>",
    "status": {
      "id": 2,
      "name": "В работе",
      "color": "#3377C3",
      "isActive": true,
      "hasDeadline": true,
      "isAppliedIndividually": false,
      "texts": [
        {
          "lang": "Ru",
          "name": "В работе"
        },
        {
          "lang": "En",
          "name": "In progress"
        }
      ]
    },
    "assigner": {
      "id": "user:5",
      "name": "Алексей Шульга"
    },
    "project": {
      "id": 12,
      "name": "Polaris Иссык-Куль"
    },
    "startDateTime": {
      "date": "12-02-2025",
      "time": "00:00",
      "datetime": "2025-02-12T00:00Z"
    },
    "endDateTime": {
      "date": "31-05-2025",
      "time": "00:00",
      "datetime": "2025-05-31T00:00Z"
    },
    "assignees": {
      "users": [
        {
          "id": "user:5",
          "name": "Алексей Шульга"
        },
        {
          "id": "user:1",
          "name": "Константин Осипов"
        },
        {
          "id": "user:4",
          "name": "Назарий Шевченко"
        }
      ],
      "groups": []
    }
  },
  {
    "id": 204,
    "name": "Заключить Договора с топовыми ресторанами, кофейными",
    "description": "",
    "status": {
      "id": 2,
      "name": "В работе",
      "color": "#3377C3",
      "isActive": true,
      "hasDeadline": true,
      "isAppliedIndividually": false,
      "texts": [
        {
          "lang": "Ru",
          "name": "В работе"
        },
        {
          "lang": "En",
          "name": "In progress"
        }
      ]
    },
    "assigner": {
      "id": "user:5",
      "name": "Алексей Шульга"
    },
    "project": {
      "id": 12,
      "name": "Polaris Иссык-Куль"
    },
    "startDateTime": {
      "date": "12-02-2025",
      "time": "00:00",
      "datetime": "2025-02-12T00:00Z"
    },
    "endDateTime": {
      "date": "30-05-2025",
      "time": "00:00",
      "datetime": "2025-05-30T00:00Z"
    },
    "assignees": {
      "users": [
        {
          "id": "user:5",
          "name": "Алексей Шульга"
        },
        {
          "id": "user:1",
          "name": "Константин Осипов"
        },
        {
          "id": "user:4",
          "name": "Назарий Шевченко"
        }
      ],
      "groups": []
    }
  },
  {
    "id": 205,
    "name": "Топосъёмка участка + очистных",
    "description": "",
    "status": {
      "id": 2,
      "name": "В работе",
      "color": "#3377C3",
      "isActive": true,
      "hasDeadline": true,
      "isAppliedIndividually": false,
      "texts": [
        {
          "lang": "Ru",
          "name": "В работе"
        },
        {
          "lang": "En",
          "name": "In progress"
        }
      ]
    },
    "assigner": {
      "id": "user:5",
      "name": "Алексей Шульга"
    },
    "project": {
      "id": 1647,
      "name": "Elysium Иссык-Куль"
    },
    "startDateTime": {
      "date": "04-02-2025",
      "time": "00:00",
      "datetime": "2025-02-04T00:00Z"
    },
    "endDateTime": {
      "date": "08-05-2025",
      "time": "00:00",
      "datetime": "2025-05-08T00:00Z"
    }
  },
  {
    "id": 220,
    "name": "Расписать все БП на сотрудников",
    "description": "",
    "status": {
      "id": 2,
      "name": "В работе",
      "color": "#3377C3",
      "isActive": true,
      "hasDeadline": true,
      "isAppliedIndividually": false,
      "texts": [
        {
          "lang": "Ru",
          "name": "В работе"
        },
        {
          "lang": "En",
          "name": "In progress"
        }
      ]
    },
    "assigner": {
      "id": "user:5",
      "name": "Алексей Шульга"
    },
    "startDateTime": {
      "date": "08-02-2025",
      "time": "00:00",
      "datetime": "2025-02-08T00:00Z"
    },
    "endDateTime": {
      "date": "30-05-2025",
      "time": "00:00",
      "datetime": "2025-05-30T00:00Z"
    },
    "assignees": {
      "users": [
        {
          "id": "user:5",
          "name": "Алексей Шульга"
        }
      ],
      "groups": []
    }
  },
  {
    "id": 225,
    "name": "Юридические задачи",
    "description": "",
    "status": {
      "id": 2,
      "name": "В работе",
      "color": "#3377C3",
      "isActive": true,
      "hasDeadline": true,
      "isAppliedIndividually": false,
      "texts": [
        {
          "lang": "Ru",
          "name": "В работе"
        },
        {
          "lang": "En",
          "name": "In progress"
        }
      ]
    },
    "assigner": {
      "id": "user:5",
      "name": "Алексей Шульга"
    },
    "project": {
      "id": 23,
      "name": "Общие вопросы компании"
    }
  },
  {
    "id": 228,
    "name": "Создать Договор продажи с клиентами (Polaris, Ellusion)",
    "description": "",
    "status": {
      "id": 1,
      "name": "Новая",
      "color": "#00b4b4",
      "isActive": true,
      "hasDeadline": true,
      "isAppliedIndividually": false,
      "texts": [
        {
          "lang": "Ru",
          "name": "Новая"
        },
        {
          "lang": "En",
          "name": "New"
        }
      ]
    },
    "assigner": {
      "id": "user:5",
      "name": "Алексей Шульга"
    },
    "project": {
      "id": 23,
      "name": "Общие вопросы компании"
    }
  },
  {
    "id": 229,
    "name": "Текущее делопроизводство",
    "description": "",
    "status": {
      "id": 2,
      "name": "В работе",
      "color": "#3377C3",
      "isActive": true,
      "hasDeadline": true,
      "isAppliedIndividually": false,
      "texts": [
        {
          "lang": "Ru",
          "name": "В работе"
        },
        {
          "lang": "En",
          "name": "In progress"
        }
      ]
    },
    "assigner": {
      "id": "user:5",
      "name": "Алексей Шульга"
    },
    "project": {
      "id": 23,
      "name": "Общие вопросы компании"
    }
  },
  {
    "id": 230,
    "name": "Проверить хранение юридических документов",
    "description": "<p>Определить места хранения</p>",
    "status": {
      "id": 1,
      "name": "Новая",
      "color": "#00b4b4",
      "isActive": true,
      "hasDeadline": true,
      "isAppliedIndividually": false,
      "texts": [
        {
          "lang": "Ru",
          "name": "Новая"
        },
        {
          "lang": "En",
          "name": "New"
        }
      ]
    },
    "assigner": {
      "id": "user:5",
      "name": "Алексей Шульга"
    },
    "project": {
      "id": 23,
      "name": "Общие вопросы компании"
    }
  },
  {
    "id": 231,
    "name": "Создать электронные почты компаний, закрепить механизм проверки",
    "description": "",
    "status": {
      "id": 1,
      "name": "Новая",
      "color": "#00b4b4",
      "isActive": true,
      "hasDeadline": true,
      "isAppliedIndividually": false,
      "texts": [
        {
          "lang": "Ru",
          "name": "Новая"
        },
        {
          "lang": "En",
          "name": "New"
        }
      ]
    },
    "assigner": {
      "id": "user:5",
      "name": "Алексей Шульга"
    },
    "project": {
      "id": 23,
      "name": "Общие вопросы компании"
    }
  },
  {
    "id": 233,
    "name": "Базы данных",
    "description": "",
    "status": {
      "id": 2,
      "name": "В работе",
      "color": "#3377C3",
      "isActive": true,
      "hasDeadline": true,
      "isAppliedIndividually": false,
      "texts": [
        {
          "lang": "Ru",
          "name": "В работе"
        },
        {
          "lang": "En",
          "name": "In progress"
        }
      ]
    },
    "assigner": {
      "id": "user:5",
      "name": "Алексей Шульга"
    },
    "project": {
      "id": 23,
      "name": "Общие вопросы компании"
    }
  },
  {
    "id": 234,
    "name": "Заполнить базы данных",
    "description": "<p>Сюда отправляем информацию по всем контактам которые мы используем. Или в личные сообщения в ТГ Назару. Структурируем их по категориям. Если потребуеться отдельные задачи по категориям - создадим отдельные задачи.</p>",
    "status": {
      "id": 2,
      "name": "В работе",
      "color": "#3377C3",
      "isActive": true,
      "hasDeadline": true,
      "isAppliedIndividually": false,
      "texts": [
        {
          "lang": "Ru",
          "name": "В работе"
        },
        {
          "lang": "En",
          "name": "In progress"
        }
      ]
    },
    "assigner": {
      "id": "user:5",
      "name": "Алексей Шульга"
    },
    "project": {
      "id": 23,
      "name": "Общие вопросы компании"
    },
    "assignees": {
      "users": [
        {
          "id": "user:4",
          "name": "Назарий Шевченко"
        }
      ],
      "groups": []
    }
  },
  {
    "id": 240,
    "name": "Согласовать кодекс компании",
    "description": "",
    "status": {
      "id": 2,
      "name": "В работе",
      "color": "#3377C3",
      "isActive": true,
      "hasDeadline": true,
      "isAppliedIndividually": false,
      "texts": [
        {
          "lang": "Ru",
          "name": "В работе"
        },
        {
          "lang": "En",
          "name": "In progress"
        }
      ]
    },
    "assigner": {
      "id": "user:5",
      "name": "Алексей Шульга"
    },
    "assignees": {
      "users": [
        {
          "id": "user:5",
          "name": "Алексей Шульга"
        }
      ],
      "groups": []
    }
  },
  {
    "id": 243,
    "name": "Системный администратор",
    "description": "",
    "status": {
      "id": 1,
      "name": "Новая",
      "color": "#00b4b4",
      "isActive": true,
      "hasDeadline": true,
      "isAppliedIndividually": false,
      "texts": [
        {
          "lang": "Ru",
          "name": "Новая"
        },
        {
          "lang": "En",
          "name": "New"
        }
      ]
    },
    "assigner": {
      "id": "user:5",
      "name": "Алексей Шульга"
    },
    "project": {
      "id": 23,
      "name": "Общие вопросы компании"
    }
  },
  {
    "id": 249,
    "name": "Архитекторы из N-group",
    "description": "",
    "status": {
      "id": 1,
      "name": "Новая",
      "color": "#00b4b4",
      "isActive": true,
      "hasDeadline": true,
      "isAppliedIndividually": false,
      "texts": [
        {
          "lang": "Ru",
          "name": "Новая"
        },
        {
          "lang": "En",
          "name": "New"
        }
      ]
    },
    "assigner": {
      "id": "user:5",
      "name": "Алексей Шульга"
    }
  },
  {
    "id": 296,
    "name": "Встреча с Ай-чарами",
    "description": "",
    "status": {
      "id": 2,
      "name": "В работе",
      "color": "#3377C3",
      "isActive": true,
      "hasDeadline": true,
      "isAppliedIndividually": false,
      "texts": [
        {
          "lang": "Ru",
          "name": "В работе"
        },
        {
          "lang": "En",
          "name": "In progress"
        }
      ]
    },
    "assigner": {
      "id": "user:5",
      "name": "Алексей Шульга"
    },
    "assignees": {
      "users": [
        {
          "id": "user:5",
          "name": "Алексей Шульга"
        }
      ],
      "groups": []
    }
  },
  {
    "id": 298,
    "name": "Выкуп прилегающих территорий",
    "description": "",
    "status": {
      "id": 2,
      "name": "В работе",
      "color": "#3377C3",
      "isActive": true,
      "hasDeadline": true,
      "isAppliedIndividually": false,
      "texts": [
        {
          "lang": "Ru",
          "name": "В работе"
        },
        {
          "lang": "En",
          "name": "In progress"
        }
      ]
    },
    "assigner": {
      "id": "user:5",
      "name": "Алексей Шульга"
    },
    "project": {
      "id": 29,
      "name": "Автовокзал"
    },
    "assignees": {
      "users": [
        {
          "id": "user:5",
          "name": "Алексей Шульга"
        },
        {
          "id": "user:1",
          "name": "Константин Осипов"
        }
      ],
      "groups": []
    }
  },
  {
    "id": 299,
    "name": "Избавится от заправки Газпромгаз",
    "description": "",
    "status": {
      "id": 2,
      "name": "В работе",
      "color": "#3377C3",
      "isActive": true,
      "hasDeadline": true,
      "isAppliedIndividually": false,
      "texts": [
        {
          "lang": "Ru",
          "name": "В работе"
        },
        {
          "lang": "En",
          "name": "In progress"
        }
      ]
    },
    "assigner": {
      "id": "user:5",
      "name": "Алексей Шульга"
    },
    "project": {
      "id": 29,
      "name": "Автовокзал"
    },
    "assignees": {
      "users": [
        {
          "id": "user:5",
          "name": "Алексей Шульга"
        },
        {
          "id": "user:1",
          "name": "Константин Осипов"
        }
      ],
      "groups": []
    }
  },
  {
    "id": 309,
    "name": "Получить участки на Автовокзале которые находятся в аренде у частников",
    "description": "<p>Мерия нам сообщила что пара участков находится в аренде у частников. И сейчас идёт процесс возрата их государству</p>",
    "status": {
      "id": 2,
      "name": "В работе",
      "color": "#3377C3",
      "isActive": true,
      "hasDeadline": true,
      "isAppliedIndividually": false,
      "texts": [
        {
          "lang": "Ru",
          "name": "В работе"
        },
        {
          "lang": "En",
          "name": "In progress"
        }
      ]
    },
    "assigner": {
      "id": "user:5",
      "name": "Алексей Шульга"
    },
    "project": {
      "id": 29,
      "name": "Автовокзал"
    },
    "assignees": {
      "users": [
        {
          "id": "user:7",
          "name": "Оксана Янковская"
        }
      ],
      "groups": []
    }
  },
  {
    "id": 314,
    "name": "Получить участки возле автовокзала на которых есть незаконная застройка",
    "description": "<p>Рядом с автовокзалом есть участки с незаконной застройкой. Мерия обещала отправить запрос в прокуратуру</p>",
    "status": {
      "id": 2,
      "name": "В работе",
      "color": "#3377C3",
      "isActive": true,
      "hasDeadline": true,
      "isAppliedIndividually": false,
      "texts": [
        {
          "lang": "Ru",
          "name": "В работе"
        },
        {
          "lang": "En",
          "name": "In progress"
        }
      ]
    },
    "assigner": {
      "id": "user:5",
      "name": "Алексей Шульга"
    },
    "project": {
      "id": 29,
      "name": "Автовокзал"
    },
    "assignees": {
      "users": [
        {
          "id": "user:7",
          "name": "Оксана Янковская"
        }
      ],
      "groups": []
    }
  },
  {
    "id": 315,
    "name": "Георгий Кексевич (Москва) Организация \"Градостроительство.",
    "description": "",
    "status": {
      "id": 2,
      "name": "В работе",
      "color": "#3377C3",
      "isActive": true,
      "hasDeadline": true,
      "isAppliedIndividually": false,
      "texts": [
        {
          "lang": "Ru",
          "name": "В работе"
        },
        {
          "lang": "En",
          "name": "In progress"
        }
      ]
    },
    "assigner": {
      "id": "user:1",
      "name": "Константин Осипов"
    },
    "project": {
      "id": 1647,
      "name": "Elysium Иссык-Куль"
    },
    "assignees": {
      "users": [
        {
          "id": "user:1",
          "name": "Константин Осипов"
        }
      ],
      "groups": []
    }
  },
  {
    "id": 317,
    "name": "Алексей Бабушкин (Катана)",
    "description": "",
    "status": {
      "id": 2,
      "name": "В работе",
      "color": "#3377C3",
      "isActive": true,
      "hasDeadline": true,
      "isAppliedIndividually": false,
      "texts": [
        {
          "lang": "Ru",
          "name": "В работе"
        },
        {
          "lang": "En",
          "name": "In progress"
        }
      ]
    },
    "assigner": {
      "id": "user:1",
      "name": "Константин Осипов"
    },
    "project": {
      "id": 1647,
      "name": "Elysium Иссык-Куль"
    },
    "assignees": {
      "users": [
        {
          "id": "user:1",
          "name": "Константин Осипов"
        }
      ],
      "groups": []
    }
  },
  {
    "id": 326,
    "name": "Получение спецусловий от института сейсмологии",
    "description": "<p>10.02 директор института сообщил что если выше 2х этажей на Иссык-куле строить то нужны будут спецусловия от его института</p>",
    "status": {
      "id": 2,
      "name": "В работе",
      "color": "#3377C3",
      "isActive": true,
      "hasDeadline": true,
      "isAppliedIndividually": false,
      "texts": [
        {
          "lang": "Ru",
          "name": "В работе"
        },
        {
          "lang": "En",
          "name": "In progress"
        }
      ]
    },
    "assigner": {
      "id": "user:5",
      "name": "Алексей Шульга"
    },
    "project": {
      "id": 12,
      "name": "Polaris Иссык-Куль"
    },
    "assignees": {
      "users": [
        {
          "id": "user:4",
          "name": "Назарий Шевченко"
        }
      ],
      "groups": []
    }
  },
  {
    "id": 355,
    "name": "Смирнов Юрий. (Глава союза архитекторов)",
    "description": "",
    "status": {
      "id": 2,
      "name": "В работе",
      "color": "#3377C3",
      "isActive": true,
      "hasDeadline": true,
      "isAppliedIndividually": false,
      "texts": [
        {
          "lang": "Ru",
          "name": "В работе"
        },
        {
          "lang": "En",
          "name": "In progress"
        }
      ]
    },
    "assigner": {
      "id": "user:1",
      "name": "Константин Осипов"
    },
    "project": {
      "id": 1647,
      "name": "Elysium Иссык-Куль"
    },
    "assignees": {
      "users": [
        {
          "id": "user:1",
          "name": "Константин Осипов"
        }
      ],
      "groups": []
    }
  },
  {
    "id": 361,
    "name": "Попов Александр",
    "description": "",
    "status": {
      "id": 2,
      "name": "В работе",
      "color": "#3377C3",
      "isActive": true,
      "hasDeadline": true,
      "isAppliedIndividually": false,
      "texts": [
        {
          "lang": "Ru",
          "name": "В работе"
        },
        {
          "lang": "En",
          "name": "In progress"
        }
      ]
    },
    "assigner": {
      "id": "user:5",
      "name": "Алексей Шульга"
    },
    "project": {
      "id": 1647,
      "name": "Elysium Иссык-Куль"
    }
  },
  {
    "id": 364,
    "name": "Николай Фанеев (IND)",
    "description": "",
    "status": {
      "id": 2,
      "name": "В работе",
      "color": "#3377C3",
      "isActive": true,
      "hasDeadline": true,
      "isAppliedIndividually": false,
      "texts": [
        {
          "lang": "Ru",
          "name": "В работе"
        },
        {
          "lang": "En",
          "name": "In progress"
        }
      ]
    },
    "assigner": {
      "id": "user:5",
      "name": "Алексей Шульга"
    },
    "project": {
      "id": 1647,
      "name": "Elysium Иссык-Куль"
    }
  },
  {
    "id": 370,
    "name": "ТЗ на геологию. Автовокзал",
    "description": "",
    "status": {
      "id": 1,
      "name": "Новая",
      "color": "#00b4b4",
      "isActive": true,
      "hasDeadline": true,
      "isAppliedIndividually": false,
      "texts": [
        {
          "lang": "Ru",
          "name": "Новая"
        },
        {
          "lang": "En",
          "name": "New"
        }
      ]
    },
    "assigner": {
      "id": "user:5",
      "name": "Алексей Шульга"
    }
  },
  {
    "id": 371,
    "name": "ТЗ на обследование",
    "description": "",
    "status": {
      "id": 1,
      "name": "Новая",
      "color": "#00b4b4",
      "isActive": true,
      "hasDeadline": true,
      "isAppliedIndividually": false,
      "texts": [
        {
          "lang": "Ru",
          "name": "Новая"
        },
        {
          "lang": "En",
          "name": "New"
        }
      ]
    },
    "assigner": {
      "id": "user:5",
      "name": "Алексей Шульга"
    }
  },
  {
    "id": 372,
    "name": "Lotte",
    "description": "",
    "status": {
      "id": 2,
      "name": "В работе",
      "color": "#3377C3",
      "isActive": true,
      "hasDeadline": true,
      "isAppliedIndividually": false,
      "texts": [
        {
          "lang": "Ru",
          "name": "В работе"
        },
        {
          "lang": "En",
          "name": "In progress"
        }
      ]
    },
    "assigner": {
      "id": "user:5",
      "name": "Алексей Шульга"
    },
    "project": {
      "id": 12,
      "name": "Polaris Иссык-Куль"
    },
    "assignees": {
      "users": [
        {
          "id": "user:4",
          "name": "Назарий Шевченко"
        }
      ],
      "groups": []
    }
  },
  {
    "id": 373,
    "name": "Cosmos",
    "description": "",
    "status": {
      "id": 2,
      "name": "В работе",
      "color": "#3377C3",
      "isActive": true,
      "hasDeadline": true,
      "isAppliedIndividually": false,
      "texts": [
        {
          "lang": "Ru",
          "name": "В работе"
        },
        {
          "lang": "En",
          "name": "In progress"
        }
      ]
    },
    "assigner": {
      "id": "user:5",
      "name": "Алексей Шульга"
    },
    "project": {
      "id": 12,
      "name": "Polaris Иссык-Куль"
    },
    "assignees": {
      "users": [
        {
          "id": "user:4",
          "name": "Назарий Шевченко"
        }
      ],
      "groups": []
    }
  },
  {
    "id": 374,
    "name": "Accor",
    "description": "",
    "status": {
      "id": 2,
      "name": "В работе",
      "color": "#3377C3",
      "isActive": true,
      "hasDeadline": true,
      "isAppliedIndividually": false,
      "texts": [
        {
          "lang": "Ru",
          "name": "В работе"
        },
        {
          "lang": "En",
          "name": "In progress"
        }
      ]
    },
    "assigner": {
      "id": "user:5",
      "name": "Алексей Шульга"
    },
    "project": {
      "id": 12,
      "name": "Polaris Иссык-Куль"
    },
    "assignees": {
      "users": [
        {
          "id": "user:4",
          "name": "Назарий Шевченко"
        }
      ],
      "groups": []
    }
  },
  {
    "id": 376,
    "name": "Договор на демонтаж",
    "description": "",
    "status": {
      "id": 1,
      "name": "Новая",
      "color": "#00b4b4",
      "isActive": true,
      "hasDeadline": true,
      "isAppliedIndividually": false,
      "texts": [
        {
          "lang": "Ru",
          "name": "Новая"
        },
        {
          "lang": "En",
          "name": "New"
        }
      ]
    },
    "assigner": {
      "id": "user:5",
      "name": "Алексей Шульга"
    }
  },
  {
    "id": 377,
    "name": "Процесс. Тендерный комитет",
    "description": "",
    "status": {
      "id": 1,
      "name": "Новая",
      "color": "#00b4b4",
      "isActive": true,
      "hasDeadline": true,
      "isAppliedIndividually": false,
      "texts": [
        {
          "lang": "Ru",
          "name": "Новая"
        },
        {
          "lang": "En",
          "name": "New"
        }
      ]
    },
    "assigner": {
      "id": "user:5",
      "name": "Алексей Шульга"
    }
  },
  {
    "id": 385,
    "name": "Попов + Архитектура письмо",
    "description": "",
    "status": {
      "id": 1,
      "name": "Новая",
      "color": "#00b4b4",
      "isActive": true,
      "hasDeadline": true,
      "isAppliedIndividually": false,
      "texts": [
        {
          "lang": "Ru",
          "name": "Новая"
        },
        {
          "lang": "En",
          "name": "New"
        }
      ]
    },
    "assigner": {
      "id": "user:5",
      "name": "Алексей Шульга"
    }
  },
  {
    "id": 389,
    "name": "14.00 Прроектанты. Автовокзал",
    "description": "",
    "status": {
      "id": 1,
      "name": "Новая",
      "color": "#00b4b4",
      "isActive": true,
      "hasDeadline": true,
      "isAppliedIndividually": false,
      "texts": [
        {
          "lang": "Ru",
          "name": "Новая"
        },
        {
          "lang": "En",
          "name": "New"
        }
      ]
    },
    "assigner": {
      "id": "user:5",
      "name": "Алексей Шульга"
    }
  },
  {
    "id": 390,
    "name": "Автовокзал. KPI",
    "description": "",
    "status": {
      "id": 1,
      "name": "Новая",
      "color": "#00b4b4",
      "isActive": true,
      "hasDeadline": true,
      "isAppliedIndividually": false,
      "texts": [
        {
          "lang": "Ru",
          "name": "Новая"
        },
        {
          "lang": "En",
          "name": "New"
        }
      ]
    },
    "assigner": {
      "id": "user:5",
      "name": "Алексей Шульга"
    }
  },
  {
    "id": 393,
    "name": "Вести контроль за производством работ",
    "description": "",
    "status": {
      "id": 2,
      "name": "В работе",
      "color": "#3377C3",
      "isActive": true,
      "hasDeadline": true,
      "isAppliedIndividually": false,
      "texts": [
        {
          "lang": "Ru",
          "name": "В работе"
        },
        {
          "lang": "En",
          "name": "In progress"
        }
      ]
    },
    "assigner": {
      "id": "user:5",
      "name": "Алексей Шульга"
    },
    "project": {
      "id": 1647,
      "name": "Elysium Иссык-Куль"
    },
    "startDateTime": {
      "date": "14-02-2025",
      "time": "00:00",
      "datetime": "2025-02-14T00:00Z"
    },
    "endDateTime": {
      "date": "09-05-2025",
      "time": "00:00",
      "datetime": "2025-05-09T00:00Z"
    },
    "assignees": {
      "users": [
        {
          "id": "user:6",
          "name": "Марлен Замиров"
        }
      ],
      "groups": []
    }
  },
  {
    "id": 394,
    "name": "Поставить забор вокруг стройплощадки",
    "description": "",
    "status": {
      "id": 2,
      "name": "В работе",
      "color": "#3377C3",
      "isActive": true,
      "hasDeadline": true,
      "isAppliedIndividually": false,
      "texts": [
        {
          "lang": "Ru",
          "name": "В работе"
        },
        {
          "lang": "En",
          "name": "In progress"
        }
      ]
    },
    "assigner": {
      "id": "user:5",
      "name": "Алексей Шульга"
    },
    "project": {
      "id": 1647,
      "name": "Elysium Иссык-Куль"
    }
  },
  {
    "id": 398,
    "name": "Встретится с Василием Юриевичем по проектированию автовокзала",
    "description": "",
    "status": {
      "id": 1,
      "name": "Новая",
      "color": "#00b4b4",
      "isActive": true,
      "hasDeadline": true,
      "isAppliedIndividually": false,
      "texts": [
        {
          "lang": "Ru",
          "name": "Новая"
        },
        {
          "lang": "En",
          "name": "New"
        }
      ]
    },
    "assigner": {
      "id": "user:5",
      "name": "Алексей Шульга"
    }
  },
  {
    "id": 402,
    "name": "Выбрать Подрядчика на концепцию (эскизный проект)",
    "description": "",
    "status": {
      "id": 0,
      "name": "Черновик",
      "color": "#3D3F46",
      "isActive": false,
      "hasDeadline": false,
      "isAppliedIndividually": false,
      "texts": [
        {
          "lang": "Ru",
          "name": "Черновик"
        },
        {
          "lang": "En",
          "name": "Draft"
        }
      ]
    },
    "assigner": {
      "id": "user:5",
      "name": "Алексей Шульга"
    },
    "project": {
      "id": 29,
      "name": "Автовокзал"
    }
  },
  {
    "id": 404,
    "name": "Кодекс компании. Ссылка",
    "description": "",
    "status": {
      "id": 2,
      "name": "В работе",
      "color": "#3377C3",
      "isActive": true,
      "hasDeadline": true,
      "isAppliedIndividually": false,
      "texts": [
        {
          "lang": "Ru",
          "name": "В работе"
        },
        {
          "lang": "En",
          "name": "In progress"
        }
      ]
    },
    "assigner": {
      "id": "user:5",
      "name": "Алексей Шульга"
    },
    "project": {
      "id": 23,
      "name": "Общие вопросы компании"
    }
  },
  {
    "id": 420,
    "name": "Получить USDT",
    "description": "",
    "status": {
      "id": 1,
      "name": "Новая",
      "color": "#00b4b4",
      "isActive": true,
      "hasDeadline": true,
      "isAppliedIndividually": false,
      "texts": [
        {
          "lang": "Ru",
          "name": "Новая"
        },
        {
          "lang": "En",
          "name": "New"
        }
      ]
    },
    "assigner": {
      "id": "user:5",
      "name": "Алексей Шульга"
    }
  },
  {
    "id": 421,
    "name": "Ознакомить всех с кодексом компании",
    "description": "",
    "status": {
      "id": 1,
      "name": "Новая",
      "color": "#00b4b4",
      "isActive": true,
      "hasDeadline": true,
      "isAppliedIndividually": false,
      "texts": [
        {
          "lang": "Ru",
          "name": "Новая"
        },
        {
          "lang": "En",
          "name": "New"
        }
      ]
    },
    "assigner": {
      "id": "user:5",
      "name": "Алексей Шульга"
    },
    "assignees": {
      "users": [
        {
          "id": "user:5",
          "name": "Алексей Шульга"
        }
      ],
      "groups": []
    }
  },
  {
    "id": 426,
    "name": "ACCOR. Ответ на предложение",
    "description": "",
    "status": {
      "id": 1,
      "name": "Новая",
      "color": "#00b4b4",
      "isActive": true,
      "hasDeadline": true,
      "isAppliedIndividually": false,
      "texts": [
        {
          "lang": "Ru",
          "name": "Новая"
        },
        {
          "lang": "En",
          "name": "New"
        }
      ]
    },
    "assigner": {
      "id": "user:5",
      "name": "Алексей Шульга"
    }
  },
  {
    "id": 473,
    "name": "Ср 11.00 Встреча с домиками",
    "description": "",
    "status": {
      "id": 1,
      "name": "Новая",
      "color": "#00b4b4",
      "isActive": true,
      "hasDeadline": true,
      "isAppliedIndividually": false,
      "texts": [
        {
          "lang": "Ru",
          "name": "Новая"
        },
        {
          "lang": "En",
          "name": "New"
        }
      ]
    },
    "assigner": {
      "id": "user:5",
      "name": "Алексей Шульга"
    }
  },
  {
    "id": 475,
    "name": "17.00 Среда. IND отельеры",
    "description": "",
    "status": {
      "id": 1,
      "name": "Новая",
      "color": "#00b4b4",
      "isActive": true,
      "hasDeadline": true,
      "isAppliedIndividually": false,
      "texts": [
        {
          "lang": "Ru",
          "name": "Новая"
        },
        {
          "lang": "En",
          "name": "New"
        }
      ]
    },
    "assigner": {
      "id": "user:5",
      "name": "Алексей Шульга"
    }
  },
  {
    "id": 476,
    "name": "Пятница 9.00 Талант",
    "description": "",
    "status": {
      "id": 1,
      "name": "Новая",
      "color": "#00b4b4",
      "isActive": true,
      "hasDeadline": true,
      "isAppliedIndividually": false,
      "texts": [
        {
          "lang": "Ru",
          "name": "Новая"
        },
        {
          "lang": "En",
          "name": "New"
        }
      ]
    },
    "assigner": {
      "id": "user:5",
      "name": "Алексей Шульга"
    }
  },
  {
    "id": 477,
    "name": "Василий Юрьевич. Забор Автовокзал",
    "description": "",
    "status": {
      "id": 1,
      "name": "Новая",
      "color": "#00b4b4",
      "isActive": true,
      "hasDeadline": true,
      "isAppliedIndividually": false,
      "texts": [
        {
          "lang": "Ru",
          "name": "Новая"
        },
        {
          "lang": "En",
          "name": "New"
        }
      ]
    },
    "assigner": {
      "id": "user:5",
      "name": "Алексей Шульга"
    }
  },
  {
    "id": 480,
    "name": "Создать бюджет на год",
    "description": "",
    "status": {
      "id": 1,
      "name": "Новая",
      "color": "#00b4b4",
      "isActive": true,
      "hasDeadline": true,
      "isAppliedIndividually": false,
      "texts": [
        {
          "lang": "Ru",
          "name": "Новая"
        },
        {
          "lang": "En",
          "name": "New"
        }
      ]
    },
    "assigner": {
      "id": "user:5",
      "name": "Алексей Шульга"
    }
  },
  {
    "id": 482,
    "name": "Получить платёж в USDT",
    "description": "",
    "status": {
      "id": 1,
      "name": "Новая",
      "color": "#00b4b4",
      "isActive": true,
      "hasDeadline": true,
      "isAppliedIndividually": false,
      "texts": [
        {
          "lang": "Ru",
          "name": "Новая"
        },
        {
          "lang": "En",
          "name": "New"
        }
      ]
    },
    "assigner": {
      "id": "user:5",
      "name": "Алексей Шульга"
    }
  },
  {
    "id": 483,
    "name": "Внести сообщение в группу о изменениях в договоре с мерией",
    "description": "",
    "status": {
      "id": 1,
      "name": "Новая",
      "color": "#00b4b4",
      "isActive": true,
      "hasDeadline": true,
      "isAppliedIndividually": false,
      "texts": [
        {
          "lang": "Ru",
          "name": "Новая"
        },
        {
          "lang": "En",
          "name": "New"
        }
      ]
    },
    "assigner": {
      "id": "user:5",
      "name": "Алексей Шульга"
    }
  },
  {
    "id": 489,
    "name": "Получить КП от LOTTE",
    "description": "",
    "status": {
      "id": 2,
      "name": "В работе",
      "color": "#3377C3",
      "isActive": true,
      "hasDeadline": true,
      "isAppliedIndividually": false,
      "texts": [
        {
          "lang": "Ru",
          "name": "В работе"
        },
        {
          "lang": "En",
          "name": "In progress"
        }
      ]
    },
    "assigner": {
      "id": "user:5",
      "name": "Алексей Шульга"
    },
    "project": {
      "id": 12,
      "name": "Polaris Иссык-Куль"
    },
    "startDateTime": {
      "date": "19-02-2025",
      "time": "00:00",
      "datetime": "2025-02-19T00:00Z"
    },
    "endDateTime": {
      "date": "22-05-2025",
      "time": "00:00",
      "datetime": "2025-05-22T00:00Z"
    },
    "assignees": {
      "users": [
        {
          "id": "user:5",
          "name": "Алексей Шульга"
        },
        {
          "id": "user:4",
          "name": "Назарий Шевченко"
        }
      ],
      "groups": []
    }
  },
  {
    "id": 491,
    "name": "Получить КП на управляющую компанию + франшизу.",
    "description": "",
    "status": {
      "id": 2,
      "name": "В работе",
      "color": "#3377C3",
      "isActive": true,
      "hasDeadline": true,
      "isAppliedIndividually": false,
      "texts": [
        {
          "lang": "Ru",
          "name": "В работе"
        },
        {
          "lang": "En",
          "name": "In progress"
        }
      ]
    },
    "assigner": {
      "id": "user:5",
      "name": "Алексей Шульга"
    },
    "project": {
      "id": 12,
      "name": "Polaris Иссык-Куль"
    },
    "assignees": {
      "users": [
        {
          "id": "user:5",
          "name": "Алексей Шульга"
        },
        {
          "id": "user:4",
          "name": "Назарий Шевченко"
        }
      ],
      "groups": []
    }
  },
  {
    "id": 493,
    "name": "Подготовить макеты брендовой продукции Девент.",
    "description": "<p>Слава, составь пожалуйста состав бренд бука.&nbsp;</p>",
    "status": {
      "id": 4,
      "name": "Отложенная",
      "color": "#85878E",
      "isActive": false,
      "hasDeadline": false,
      "isAppliedIndividually": false,
      "texts": [
        {
          "lang": "Ru",
          "name": "Отложенная"
        },
        {
          "lang": "En",
          "name": "On hold"
        }
      ]
    },
    "assigner": {
      "id": "user:1",
      "name": "Константин Осипов"
    },
    "project": {
      "id": 116,
      "name": "Маркетинг"
    },
    "endDateTime": {
      "date": "12-05-2025",
      "time": "00:00",
      "datetime": "2025-05-12T00:00Z"
    },
    "assignees": {
      "users": [
        {
          "id": "user:3",
          "name": "Вячеслав Фоменко"
        },
        {
          "id": "user:9",
          "name": "Бахтияр Ибрагимов"
        }
      ],
      "groups": []
    }
  },
  {
    "id": 494,
    "name": "Разное",
    "description": "",
    "status": {
      "id": 2,
      "name": "В работе",
      "color": "#3377C3",
      "isActive": true,
      "hasDeadline": true,
      "isAppliedIndividually": false,
      "texts": [
        {
          "lang": "Ru",
          "name": "В работе"
        },
        {
          "lang": "En",
          "name": "In progress"
        }
      ]
    },
    "assigner": {
      "id": "user:5",
      "name": "Алексей Шульга"
    },
    "project": {
      "id": 12,
      "name": "Polaris Иссык-Куль"
    },
    "assignees": {
      "users": [
        {
          "id": "user:4",
          "name": "Назарий Шевченко"
        }
      ],
      "groups": []
    }
  },
  {
    "id": 495,
    "name": "Установка забора",
    "description": "",
    "status": {
      "id": 2,
      "name": "В работе",
      "color": "#3377C3",
      "isActive": true,
      "hasDeadline": true,
      "isAppliedIndividually": false,
      "texts": [
        {
          "lang": "Ru",
          "name": "В работе"
        },
        {
          "lang": "En",
          "name": "In progress"
        }
      ]
    },
    "assigner": {
      "id": "user:5",
      "name": "Алексей Шульга"
    },
    "project": {
      "id": 12,
      "name": "Polaris Иссык-Куль"
    },
    "assignees": {
      "users": [
        {
          "id": "user:4",
          "name": "Назарий Шевченко"
        }
      ],
      "groups": []
    }
  },
  {
    "id": 496,
    "name": "Создать ТЗ на установку забора",
    "description": "",
    "status": {
      "id": 2,
      "name": "В работе",
      "color": "#3377C3",
      "isActive": true,
      "hasDeadline": true,
      "isAppliedIndividually": false,
      "texts": [
        {
          "lang": "Ru",
          "name": "В работе"
        },
        {
          "lang": "En",
          "name": "In progress"
        }
      ]
    },
    "assigner": {
      "id": "user:5",
      "name": "Алексей Шульга"
    },
    "project": {
      "id": 12,
      "name": "Polaris Иссык-Куль"
    },
    "startDateTime": {
      "date": "25-03-2025",
      "time": "00:00",
      "datetime": "2025-03-25T00:00Z"
    },
    "assignees": {
      "users": [
        {
          "id": "user:5",
          "name": "Алексей Шульга"
        },
        {
          "id": "user:4",
          "name": "Назарий Шевченко"
        }
      ],
      "groups": []
    }
  },
  {
    "id": 499,
    "name": "Создать портал для Devent Кыргызстан",
    "description": "",
    "status": {
      "id": 2,
      "name": "В работе",
      "color": "#3377C3",
      "isActive": true,
      "hasDeadline": true,
      "isAppliedIndividually": false,
      "texts": [
        {
          "lang": "Ru",
          "name": "В работе"
        },
        {
          "lang": "En",
          "name": "In progress"
        }
      ]
    },
    "assigner": {
      "id": "user:3",
      "name": "Вячеслав Фоменко"
    },
    "project": {
      "id": 116,
      "name": "Маркетинг"
    },
    "assignees": {
      "users": [
        {
          "id": "user:3",
          "name": "Вячеслав Фоменко"
        }
      ],
      "groups": []
    }
  },
  {
    "id": 501,
    "name": "Согласовать и купить сервер",
    "description": "Согласовать и купить сервер",
    "status": {
      "id": 2,
      "name": "В работе",
      "color": "#3377C3",
      "isActive": true,
      "hasDeadline": true,
      "isAppliedIndividually": false,
      "texts": [
        {
          "lang": "Ru",
          "name": "В работе"
        },
        {
          "lang": "En",
          "name": "In progress"
        }
      ]
    },
    "assigner": {
      "id": "user:3",
      "name": "Вячеслав Фоменко"
    },
    "project": {
      "id": 116,
      "name": "Маркетинг"
    },
    "assignees": {
      "users": [
        {
          "id": "user:3",
          "name": "Вячеслав Фоменко"
        }
      ],
      "groups": []
    }
  },
  {
    "id": 511,
    "name": "Оплаты",
    "description": "",
    "status": {
      "id": 1,
      "name": "Новая",
      "color": "#00b4b4",
      "isActive": true,
      "hasDeadline": true,
      "isAppliedIndividually": false,
      "texts": [
        {
          "lang": "Ru",
          "name": "Новая"
        },
        {
          "lang": "En",
          "name": "New"
        }
      ]
    },
    "assigner": {
      "id": "user:1",
      "name": "Константин Осипов"
    },
    "project": {
      "id": 116,
      "name": "Маркетинг"
    }
  },
  {
    "id": 526,
    "name": "Поларис. ТЗ на забор",
    "description": "",
    "status": {
      "id": 1,
      "name": "Новая",
      "color": "#00b4b4",
      "isActive": true,
      "hasDeadline": true,
      "isAppliedIndividually": false,
      "texts": [
        {
          "lang": "Ru",
          "name": "Новая"
        },
        {
          "lang": "En",
          "name": "New"
        }
      ]
    },
    "assigner": {
      "id": "user:5",
      "name": "Алексей Шульга"
    }
  },
  {
    "id": 535,
    "name": "Внедрить BPM в компанию до уровня полной автоматизации процессов",
    "description": "<p><a href=\"https://docsvision.com/info-centr/articles/bpm-business-process-management.html\">https://docsvision.com/info-centr/articles/bpm-business-process-management.html</a><br /><br />Это краткое описание первое что нашлось.</p><p>&nbsp;</p><p>Сам подбери курс по BPM, тут им поделись, и меня будет интересовать твой конспект по изучению процессов. Создай в любой удобной программе и добавь ссылку сюда.<br /><br />Мы сразу внедряем и выстраиваем.</p><p>&nbsp;</p><p>(задача до 30 апреля).</p>",
    "status": {
      "id": 2,
      "name": "В работе",
      "color": "#3377C3",
      "isActive": true,
      "hasDeadline": true,
      "isAppliedIndividually": false,
      "texts": [
        {
          "lang": "Ru",
          "name": "В работе"
        },
        {
          "lang": "En",
          "name": "In progress"
        }
      ]
    },
    "assigner": {
      "id": "user:1",
      "name": "Константин Осипов"
    },
    "project": {
      "id": 23,
      "name": "Общие вопросы компании"
    },
    "assignees": {
      "users": [
        {
          "id": "user:9",
          "name": "Бахтияр Ибрагимов"
        }
      ],
      "groups": []
    }
  },
  {
    "id": 536,
    "name": "Добавить процесс, должностную инструкцию в кодекс компании (повторяющаяся задача).",
    "description": "",
    "status": {
      "id": 2,
      "name": "В работе",
      "color": "#3377C3",
      "isActive": true,
      "hasDeadline": true,
      "isAppliedIndividually": false,
      "texts": [
        {
          "lang": "Ru",
          "name": "В работе"
        },
        {
          "lang": "En",
          "name": "In progress"
        }
      ]
    },
    "assigner": {
      "id": "user:1",
      "name": "Константин Осипов"
    },
    "project": {
      "id": 23,
      "name": "Общие вопросы компании"
    },
    "assignees": {
      "users": [
        {
          "id": "user:9",
          "name": "Бахтияр Ибрагимов"
        }
      ],
      "groups": []
    }
  },
  {
    "id": 550,
    "name": "Сергей. Работа в Планфикс",
    "description": "",
    "status": {
      "id": 1,
      "name": "Новая",
      "color": "#00b4b4",
      "isActive": true,
      "hasDeadline": true,
      "isAppliedIndividually": false,
      "texts": [
        {
          "lang": "Ru",
          "name": "Новая"
        },
        {
          "lang": "En",
          "name": "New"
        }
      ]
    },
    "assigner": {
      "id": "user:5",
      "name": "Алексей Шульга"
    }
  },
  {
    "id": 554,
    "name": "Подготовить меморандум и подписать документы с владельцами 6 домиков на Кыргыз Таны",
    "description": "<p>Сеид, тут действуем как договорились. Готовь меморандум.</p>",
    "status": {
      "id": 2,
      "name": "В работе",
      "color": "#3377C3",
      "isActive": true,
      "hasDeadline": true,
      "isAppliedIndividually": false,
      "texts": [
        {
          "lang": "Ru",
          "name": "В работе"
        },
        {
          "lang": "En",
          "name": "In progress"
        }
      ]
    },
    "assigner": {
      "id": "user:1",
      "name": "Константин Осипов"
    },
    "project": {
      "id": 1647,
      "name": "Elysium Иссык-Куль"
    },
    "endDateTime": {
      "date": "16-05-2025",
      "time": "00:00",
      "datetime": "2025-05-16T00:00Z"
    },
    "assignees": {
      "users": [
        {
          "id": "user:8",
          "name": "Сеид Бостанов"
        }
      ],
      "groups": []
    }
  },
  {
    "id": 563,
    "name": "Найм персонала",
    "description": "",
    "status": {
      "id": 2,
      "name": "В работе",
      "color": "#3377C3",
      "isActive": true,
      "hasDeadline": true,
      "isAppliedIndividually": false,
      "texts": [
        {
          "lang": "Ru",
          "name": "В работе"
        },
        {
          "lang": "En",
          "name": "In progress"
        }
      ]
    },
    "assigner": {
      "id": "user:5",
      "name": "Алексей Шульга"
    },
    "project": {
      "id": 23,
      "name": "Общие вопросы компании"
    }
  },
  {
    "id": 573,
    "name": "Бюджеты и графики",
    "description": "",
    "status": {
      "id": 1,
      "name": "Новая",
      "color": "#00b4b4",
      "isActive": true,
      "hasDeadline": true,
      "isAppliedIndividually": false,
      "texts": [
        {
          "lang": "Ru",
          "name": "Новая"
        },
        {
          "lang": "En",
          "name": "New"
        }
      ]
    },
    "assigner": {
      "id": "user:5",
      "name": "Алексей Шульга"
    },
    "project": {
      "id": 23,
      "name": "Общие вопросы компании"
    }
  },
  {
    "id": 575,
    "name": "Оплаты",
    "description": "",
    "status": {
      "id": 1,
      "name": "Новая",
      "color": "#00b4b4",
      "isActive": true,
      "hasDeadline": true,
      "isAppliedIndividually": false,
      "texts": [
        {
          "lang": "Ru",
          "name": "Новая"
        },
        {
          "lang": "En",
          "name": "New"
        }
      ]
    },
    "assigner": {
      "id": "user:5",
      "name": "Алексей Шульга"
    },
    "project": {
      "id": 23,
      "name": "Общие вопросы компании"
    }
  },
  {
    "id": 576,
    "name": "Отработать регламент оплат",
    "description": "<p>Можно рассмотреть вариант тут вести согласование оплат. Сделать регламент и в Планфиксе согласовывать оплаты.</p>",
    "status": {
      "id": 2,
      "name": "В работе",
      "color": "#3377C3",
      "isActive": true,
      "hasDeadline": true,
      "isAppliedIndividually": false,
      "texts": [
        {
          "lang": "Ru",
          "name": "В работе"
        },
        {
          "lang": "En",
          "name": "In progress"
        }
      ]
    },
    "assigner": {
      "id": "user:5",
      "name": "Алексей Шульга"
    },
    "project": {
      "id": 23,
      "name": "Общие вопросы компании"
    },
    "assignees": {
      "users": [
        {
          "id": "user:3",
          "name": "Вячеслав Фоменко"
        },
        {
          "id": "user:5",
          "name": "Алексей Шульга"
        },
        {
          "id": "user:1",
          "name": "Константин Осипов"
        }
      ],
      "groups": []
    }
  },
  {
    "id": 577,
    "name": "Создать общую матрицу функций + структуру компании",
    "description": "",
    "status": {
      "id": 2,
      "name": "В работе",
      "color": "#3377C3",
      "isActive": true,
      "hasDeadline": true,
      "isAppliedIndividually": false,
      "texts": [
        {
          "lang": "Ru",
          "name": "В работе"
        },
        {
          "lang": "En",
          "name": "In progress"
        }
      ]
    },
    "assigner": {
      "id": "user:5",
      "name": "Алексей Шульга"
    },
    "project": {
      "id": 23,
      "name": "Общие вопросы компании"
    },
    "assignees": {
      "users": [
        {
          "id": "user:5",
          "name": "Алексей Шульга"
        }
      ],
      "groups": []
    }
  },
  {
    "id": 585,
    "name": "Стратегические вопросы",
    "description": "",
    "status": {
      "id": 2,
      "name": "В работе",
      "color": "#3377C3",
      "isActive": true,
      "hasDeadline": true,
      "isAppliedIndividually": false,
      "texts": [
        {
          "lang": "Ru",
          "name": "В работе"
        },
        {
          "lang": "En",
          "name": "In progress"
        }
      ]
    },
    "assigner": {
      "id": "user:5",
      "name": "Алексей Шульга"
    },
    "project": {
      "id": 23,
      "name": "Общие вопросы компании"
    }
  },
  {
    "id": 594,
    "name": "Подписать наш АВР (январь+февраль+март)",
    "description": "",
    "status": {
      "id": 2,
      "name": "В работе",
      "color": "#3377C3",
      "isActive": true,
      "hasDeadline": true,
      "isAppliedIndividually": false,
      "texts": [
        {
          "lang": "Ru",
          "name": "В работе"
        },
        {
          "lang": "En",
          "name": "In progress"
        }
      ]
    },
    "assigner": {
      "id": "user:5",
      "name": "Алексей Шульга"
    },
    "project": {
      "id": 23,
      "name": "Общие вопросы компании"
    },
    "assignees": {
      "users": [
        {
          "id": "user:5",
          "name": "Алексей Шульга"
        },
        {
          "id": "user:1",
          "name": "Константин Осипов"
        }
      ],
      "groups": []
    }
  },
  {
    "id": 608,
    "name": "Снабжение и цены",
    "description": "",
    "status": {
      "id": 1,
      "name": "Новая",
      "color": "#00b4b4",
      "isActive": true,
      "hasDeadline": true,
      "isAppliedIndividually": false,
      "texts": [
        {
          "lang": "Ru",
          "name": "Новая"
        },
        {
          "lang": "En",
          "name": "New"
        }
      ]
    },
    "assigner": {
      "id": "user:5",
      "name": "Алексей Шульга"
    },
    "project": {
      "id": 23,
      "name": "Общие вопросы компании"
    }
  },
  {
    "id": 613,
    "name": "Получить по акту приёма-передачи здание",
    "description": "<p>Сейчас мы будем проводить работы внутри здания по обследованию его + делать шурфы.<br />Там в помещениях есть мебель и прочее имущество.<br />Необходимо получить это здание по акту приёма-передачи с указанием что никакого имущества находщегося на баланса государства там нет.<br />Такая же ситуация с участком в целом</p>",
    "status": {
      "id": 2,
      "name": "В работе",
      "color": "#3377C3",
      "isActive": true,
      "hasDeadline": true,
      "isAppliedIndividually": false,
      "texts": [
        {
          "lang": "Ru",
          "name": "В работе"
        },
        {
          "lang": "En",
          "name": "In progress"
        }
      ]
    },
    "assigner": {
      "id": "user:5",
      "name": "Алексей Шульга"
    },
    "project": {
      "id": 29,
      "name": "Автовокзал"
    },
    "assignees": {
      "users": [
        {
          "id": "user:5",
          "name": "Алексей Шульга"
        },
        {
          "id": "user:7",
          "name": "Оксана Янковская"
        }
      ],
      "groups": []
    }
  },
  {
    "id": 614,
    "name": "Заявки",
    "description": "",
    "status": {
      "id": 1,
      "name": "Новая",
      "color": "#00b4b4",
      "isActive": true,
      "hasDeadline": true,
      "isAppliedIndividually": false,
      "texts": [
        {
          "lang": "Ru",
          "name": "Новая"
        },
        {
          "lang": "En",
          "name": "New"
        }
      ]
    },
    "assigner": {
      "id": "user:5",
      "name": "Алексей Шульга"
    },
    "project": {
      "id": 23,
      "name": "Общие вопросы компании"
    }
  },
  {
    "id": 616,
    "name": "Покупка наушников",
    "description": "<p>Счёт</p>",
    "status": {
      "id": 1,
      "name": "Новая",
      "color": "#00b4b4",
      "isActive": true,
      "hasDeadline": true,
      "isAppliedIndividually": false,
      "texts": [
        {
          "lang": "Ru",
          "name": "Новая"
        },
        {
          "lang": "En",
          "name": "New"
        }
      ]
    },
    "assigner": {
      "id": "user:5",
      "name": "Алексей Шульга"
    },
    "project": {
      "id": 23,
      "name": "Общие вопросы компании"
    }
  },
  {
    "id": 618,
    "name": "Сделать наш бюджет",
    "description": "",
    "status": {
      "id": 1,
      "name": "Новая",
      "color": "#00b4b4",
      "isActive": true,
      "hasDeadline": true,
      "isAppliedIndividually": false,
      "texts": [
        {
          "lang": "Ru",
          "name": "Новая"
        },
        {
          "lang": "En",
          "name": "New"
        }
      ]
    },
    "assigner": {
      "id": "user:5",
      "name": "Алексей Шульга"
    }
  },
  {
    "id": 620,
    "name": "Для обеспечения качественной связи при онлайн-встречах необходимо приобрести наушники с микрофоном.",
    "description": "<p>Вот три варианта&nbsp;</p><p><a href=\"https://enter.kg/naushniki_bishkek/6a9816a025ce41bdefaad783808df5c5-detail\"><strong>HYPERX 4P4F0AA</strong></a>&nbsp;<strong>(беспроводные)&nbsp;</strong>- <strong>6803 Сом</strong><span style=\"color: rgb(0, 0, 0); font-family: Arial, Helvetica, sans-serif; font-size: 14px; font-style: normal; font-variant-ligatures: normal; font-variant-caps: normal; font-weight: 700; letter-spacing: normal; orphans: 2; text-align: center; ; text-transform: none; widows: 2; word-spacing: 0px; -webkit-text-stroke-width: 0px; white-space: normal; background-color: rgb(255, 255, 255); text-decoration-thickness: initial; text-decoration-style: initial; text-decoration-color: initial; display: inline !important; float: none;\"><strong><span>&nbsp;</span></strong><br /><a href=\"https://enter.kg/naushniki_bishkek/f74d16a2c28a28adaf70e3d584bff4ed-detail\">HYPERX 4P4F2AA</a> (проводные) -&nbsp;&nbsp;5978 Сом<br /><a href=\"https://enter.kg/naushniki_bishkek/f2e00563945843d1ad19ea0587f24949-detail\">Edifier W800BT Plus Bluetooth 5.1</a>&nbsp;</span><strong>(беспроводные)&nbsp;</strong><span style=\"color: rgb(0, 0, 0); font-family: Arial, Helvetica, sans-serif; font-size: 14px; font-style: normal; font-variant-ligatures: normal; font-variant-caps: normal; font-weight: 700; letter-spacing: normal; orphans: 2; text-align: center; ; text-transform: none; widows: 2; word-spacing: 0px; -webkit-text-stroke-width: 0px; white-space: normal; background-color: rgb(255, 255, 255); text-decoration-thickness: initial; text-decoration-style: initial; text-decoration-color: initial; display: inline !important; float: none;\">-&nbsp;3466 Сом</span></p>",
    "status": {
      "id": 0,
      "name": "Черновик",
      "color": "#3D3F46",
      "isActive": false,
      "hasDeadline": false,
      "isAppliedIndividually": false,
      "texts": [
        {
          "lang": "Ru",
          "name": "Черновик"
        },
        {
          "lang": "En",
          "name": "Draft"
        }
      ]
    },
    "assigner": {
      "id": "user:9",
      "name": "Бахтияр Ибрагимов"
    },
    "project": {
      "id": 23,
      "name": "Общие вопросы компании"
    }
  },
  {
    "id": 631,
    "name": "Обсудить все проекты",
    "description": "",
    "status": {
      "id": 1,
      "name": "Новая",
      "color": "#00b4b4",
      "isActive": true,
      "hasDeadline": true,
      "isAppliedIndividually": false,
      "texts": [
        {
          "lang": "Ru",
          "name": "Новая"
        },
        {
          "lang": "En",
          "name": "New"
        }
      ]
    },
    "assigner": {
      "id": "user:5",
      "name": "Алексей Шульга"
    }
  },
  {
    "id": 632,
    "name": "Доработка концепции автовокзала. IND",
    "description": "",
    "status": {
      "id": 2,
      "name": "В работе",
      "color": "#3377C3",
      "isActive": true,
      "hasDeadline": true,
      "isAppliedIndividually": false,
      "texts": [
        {
          "lang": "Ru",
          "name": "В работе"
        },
        {
          "lang": "En",
          "name": "In progress"
        }
      ]
    },
    "assigner": {
      "id": "user:5",
      "name": "Алексей Шульга"
    },
    "project": {
      "id": 29,
      "name": "Автовокзал"
    },
    "startDateTime": {
      "date": "03-05-2025",
      "time": "00:00",
      "datetime": "2025-05-03T00:00Z"
    },
    "endDateTime": {
      "date": "16-06-2025",
      "time": "00:00",
      "datetime": "2025-06-16T00:00Z"
    },
    "assignees": {
      "users": [
        {
          "id": "user:5",
          "name": "Алексей Шульга"
        }
      ],
      "groups": []
    }
  },
  {
    "id": 637,
    "name": "Разработка концепции. SSS",
    "description": "",
    "status": {
      "id": 2,
      "name": "В работе",
      "color": "#3377C3",
      "isActive": true,
      "hasDeadline": true,
      "isAppliedIndividually": false,
      "texts": [
        {
          "lang": "Ru",
          "name": "В работе"
        },
        {
          "lang": "En",
          "name": "In progress"
        }
      ]
    },
    "assigner": {
      "id": "user:5",
      "name": "Алексей Шульга"
    },
    "project": {
      "id": 12,
      "name": "Polaris Иссык-Куль"
    },
    "assignees": {
      "users": [
        {
          "id": "user:4",
          "name": "Назарий Шевченко"
        }
      ],
      "groups": []
    }
  },
  {
    "id": 643,
    "name": "Получить КП + инфо по отельерам",
    "description": "<p>4.03 Говорил с Кексевича. Отправил концпцию Царика. До конца недели он должен отправить своё КП с детальными планировками и с визуализациями. А также контакты отельеров с которыми можно реализовать этот проект</p>",
    "status": {
      "id": 2,
      "name": "В работе",
      "color": "#3377C3",
      "isActive": true,
      "hasDeadline": true,
      "isAppliedIndividually": false,
      "texts": [
        {
          "lang": "Ru",
          "name": "В работе"
        },
        {
          "lang": "En",
          "name": "In progress"
        }
      ]
    },
    "assigner": {
      "id": "user:5",
      "name": "Алексей Шульга"
    },
    "project": {
      "id": 1647,
      "name": "Elysium Иссык-Куль"
    },
    "assignees": {
      "users": [
        {
          "id": "user:5",
          "name": "Алексей Шульга"
        }
      ],
      "groups": []
    }
  },
  {
    "id": 655,
    "name": "Места для изучения",
    "description": "",
    "status": {
      "id": 2,
      "name": "В работе",
      "color": "#3377C3",
      "isActive": true,
      "hasDeadline": true,
      "isAppliedIndividually": false,
      "texts": [
        {
          "lang": "Ru",
          "name": "В работе"
        },
        {
          "lang": "En",
          "name": "In progress"
        }
      ]
    },
    "assigner": {
      "id": "user:5",
      "name": "Алексей Шульга"
    },
    "project": {
      "id": 23,
      "name": "Общие вопросы компании"
    }
  },
  {
    "id": 657,
    "name": "Систематизировать собранные данные о конкурентах",
    "description": "<p>Был утвержден процесс по сбору и систематизации данных о конкурентах</p><p>&nbsp;</p><p><a href=\"https://docs.google.com/document/d/1TVSSYBpzzIQpYf3_ZPGk-2GY-vSurYE7w-7_DYZJB8A/edit?tab=t.0#heading=h.tbw3hjf17isv\">https://docs.google.com/document/d/1TVSSYBpzzIQpYf3_ZPGk-2GY-vSurYE7w-7_DYZJB8A/edit?tab=t.0#heading=h.tbw3hjf17isv</a></p><p>&nbsp;</p><p>С Константином утвердили, кто из сотрудников участвует в процессе:</p><p>&nbsp;</p><p>1.Сбор данных о конкурентах<br />Талант, Данияр</p><p>&nbsp;</p><p>2. Структурирование данных в облаке и таблице<br />Назарий</p><p>&nbsp;</p><p>Нужно протестировать процесс. Начнём с задачи, где собирались данные:&nbsp;<a href=\"https://deventky.planfix.com/task/417\">https://deventky.planfix.com/task/417</a></p><p>И следуя процессу нужно сохранить данные в облаке и внести в таблицу.</p>",
    "status": {
      "id": 2,
      "name": "В работе",
      "color": "#3377C3",
      "isActive": true,
      "hasDeadline": true,
      "isAppliedIndividually": false,
      "texts": [
        {
          "lang": "Ru",
          "name": "В работе"
        },
        {
          "lang": "En",
          "name": "In progress"
        }
      ]
    },
    "assigner": {
      "id": "user:3",
      "name": "Вячеслав Фоменко"
    },
    "project": {
      "id": 116,
      "name": "Маркетинг"
    },
    "assignees": {
      "users": [
        {
          "id": "user:4",
          "name": "Назарий Шевченко"
        }
      ],
      "groups": []
    }
  },
  {
    "id": 662,
    "name": "Создать рекламные кампании",
    "description": "",
    "status": {
      "id": 2,
      "name": "В работе",
      "color": "#3377C3",
      "isActive": true,
      "hasDeadline": true,
      "isAppliedIndividually": false,
      "texts": [
        {
          "lang": "Ru",
          "name": "В работе"
        },
        {
          "lang": "En",
          "name": "In progress"
        }
      ]
    },
    "assigner": {
      "id": "user:3",
      "name": "Вячеслав Фоменко"
    },
    "project": {
      "id": 116,
      "name": "Маркетинг"
    },
    "assignees": {
      "users": [
        {
          "id": "user:3",
          "name": "Вячеслав Фоменко"
        }
      ],
      "groups": []
    }
  },
  {
    "id": 663,
    "name": "Подготовить тендер на подрядчика для ведения рекламных кампаний для наших проектов",
    "description": "Провести тендер на подрядчика для ведение рекламных кампаний для наших проектов",
    "status": {
      "id": 2,
      "name": "В работе",
      "color": "#3377C3",
      "isActive": true,
      "hasDeadline": true,
      "isAppliedIndividually": false,
      "texts": [
        {
          "lang": "Ru",
          "name": "В работе"
        },
        {
          "lang": "En",
          "name": "In progress"
        }
      ]
    },
    "assigner": {
      "id": "user:3",
      "name": "Вячеслав Фоменко"
    },
    "project": {
      "id": 116,
      "name": "Маркетинг"
    },
    "endDateTime": {
      "date": "08-05-2025",
      "time": "00:00",
      "datetime": "2025-05-08T00:00Z"
    },
    "assignees": {
      "users": [
        {
          "id": "user:3",
          "name": "Вячеслав Фоменко"
        }
      ],
      "groups": []
    }
  },
  {
    "id": 686,
    "name": "Автовокзал",
    "description": "",
    "status": {
      "id": 2,
      "name": "В работе",
      "color": "#3377C3",
      "isActive": true,
      "hasDeadline": true,
      "isAppliedIndividually": false,
      "texts": [
        {
          "lang": "Ru",
          "name": "В работе"
        },
        {
          "lang": "En",
          "name": "In progress"
        }
      ]
    },
    "assigner": {
      "id": "user:3",
      "name": "Вячеслав Фоменко"
    },
    "project": {
      "id": 116,
      "name": "Маркетинг"
    }
  },
  {
    "id": 687,
    "name": "Маркетинговая концепция и стратегия",
    "description": "Маркетинговая концепция и стратегия",
    "status": {
      "id": 1,
      "name": "Новая",
      "color": "#00b4b4",
      "isActive": true,
      "hasDeadline": true,
      "isAppliedIndividually": false,
      "texts": [
        {
          "lang": "Ru",
          "name": "Новая"
        },
        {
          "lang": "En",
          "name": "New"
        }
      ]
    },
    "assigner": {
      "id": "user:3",
      "name": "Вячеслав Фоменко"
    },
    "project": {
      "id": 116,
      "name": "Маркетинг"
    }
  },
  {
    "id": 688,
    "name": "Рекламные кампании",
    "description": "Рекламные кампании",
    "status": {
      "id": 1,
      "name": "Новая",
      "color": "#00b4b4",
      "isActive": true,
      "hasDeadline": true,
      "isAppliedIndividually": false,
      "texts": [
        {
          "lang": "Ru",
          "name": "Новая"
        },
        {
          "lang": "En",
          "name": "New"
        }
      ]
    },
    "assigner": {
      "id": "user:3",
      "name": "Вячеслав Фоменко"
    },
    "project": {
      "id": 116,
      "name": "Маркетинг"
    }
  },
  {
    "id": 689,
    "name": "Рекламные материалы",
    "description": "Рекламные материалы",
    "status": {
      "id": 1,
      "name": "Новая",
      "color": "#00b4b4",
      "isActive": true,
      "hasDeadline": true,
      "isAppliedIndividually": false,
      "texts": [
        {
          "lang": "Ru",
          "name": "Новая"
        },
        {
          "lang": "En",
          "name": "New"
        }
      ]
    },
    "assigner": {
      "id": "user:3",
      "name": "Вячеслав Фоменко"
    },
    "project": {
      "id": 116,
      "name": "Маркетинг"
    }
  },
  {
    "id": 690,
    "name": "Брендбук",
    "description": "Брендбук",
    "status": {
      "id": 2,
      "name": "В работе",
      "color": "#3377C3",
      "isActive": true,
      "hasDeadline": true,
      "isAppliedIndividually": false,
      "texts": [
        {
          "lang": "Ru",
          "name": "В работе"
        },
        {
          "lang": "En",
          "name": "In progress"
        }
      ]
    },
    "assigner": {
      "id": "user:3",
      "name": "Вячеслав Фоменко"
    },
    "project": {
      "id": 116,
      "name": "Маркетинг"
    }
  },
  {
    "id": 691,
    "name": "Polaris",
    "description": "",
    "status": {
      "id": 2,
      "name": "В работе",
      "color": "#3377C3",
      "isActive": true,
      "hasDeadline": true,
      "isAppliedIndividually": false,
      "texts": [
        {
          "lang": "Ru",
          "name": "В работе"
        },
        {
          "lang": "En",
          "name": "In progress"
        }
      ]
    },
    "assigner": {
      "id": "user:3",
      "name": "Вячеслав Фоменко"
    },
    "project": {
      "id": 116,
      "name": "Маркетинг"
    }
  },
  {
    "id": 692,
    "name": "Маркетинговая концепция и стратегия",
    "description": "Маркетинговая концепция и стратегия",
    "status": {
      "id": 2,
      "name": "В работе",
      "color": "#3377C3",
      "isActive": true,
      "hasDeadline": true,
      "isAppliedIndividually": false,
      "texts": [
        {
          "lang": "Ru",
          "name": "В работе"
        },
        {
          "lang": "En",
          "name": "In progress"
        }
      ]
    },
    "assigner": {
      "id": "user:3",
      "name": "Вячеслав Фоменко"
    },
    "project": {
      "id": 116,
      "name": "Маркетинг"
    }
  },
  {
    "id": 693,
    "name": "Рекламные кампании",
    "description": "Рекламные кампании",
    "status": {
      "id": 2,
      "name": "В работе",
      "color": "#3377C3",
      "isActive": true,
      "hasDeadline": true,
      "isAppliedIndividually": false,
      "texts": [
        {
          "lang": "Ru",
          "name": "В работе"
        },
        {
          "lang": "En",
          "name": "In progress"
        }
      ]
    },
    "assigner": {
      "id": "user:3",
      "name": "Вячеслав Фоменко"
    },
    "project": {
      "id": 116,
      "name": "Маркетинг"
    }
  },
  {
    "id": 694,
    "name": "Рекламные материалы",
    "description": "Рекламные материалы",
    "status": {
      "id": 2,
      "name": "В работе",
      "color": "#3377C3",
      "isActive": true,
      "hasDeadline": true,
      "isAppliedIndividually": false,
      "texts": [
        {
          "lang": "Ru",
          "name": "В работе"
        },
        {
          "lang": "En",
          "name": "In progress"
        }
      ]
    },
    "assigner": {
      "id": "user:3",
      "name": "Вячеслав Фоменко"
    },
    "project": {
      "id": 116,
      "name": "Маркетинг"
    }
  },
  {
    "id": 695,
    "name": "Брендбук",
    "description": "Брендбук",
    "status": {
      "id": 2,
      "name": "В работе",
      "color": "#3377C3",
      "isActive": true,
      "hasDeadline": true,
      "isAppliedIndividually": false,
      "texts": [
        {
          "lang": "Ru",
          "name": "В работе"
        },
        {
          "lang": "En",
          "name": "In progress"
        }
      ]
    },
    "assigner": {
      "id": "user:3",
      "name": "Вячеслав Фоменко"
    },
    "project": {
      "id": 116,
      "name": "Маркетинг"
    }
  },
  {
    "id": 696,
    "name": "Elysium",
    "description": "",
    "status": {
      "id": 0,
      "name": "Черновик",
      "color": "#3D3F46",
      "isActive": false,
      "hasDeadline": false,
      "isAppliedIndividually": false,
      "texts": [
        {
          "lang": "Ru",
          "name": "Черновик"
        },
        {
          "lang": "En",
          "name": "Draft"
        }
      ]
    },
    "assigner": {
      "id": "user:3",
      "name": "Вячеслав Фоменко"
    },
    "project": {
      "id": 116,
      "name": "Маркетинг"
    }
  },
  {
    "id": 697,
    "name": "Маркетинговая концепция и стратегия",
    "description": "Маркетинговая концепция и стратегия",
    "status": {
      "id": 0,
      "name": "Черновик",
      "color": "#3D3F46",
      "isActive": false,
      "hasDeadline": false,
      "isAppliedIndividually": false,
      "texts": [
        {
          "lang": "Ru",
          "name": "Черновик"
        },
        {
          "lang": "En",
          "name": "Draft"
        }
      ]
    },
    "assigner": {
      "id": "user:3",
      "name": "Вячеслав Фоменко"
    },
    "project": {
      "id": 116,
      "name": "Маркетинг"
    }
  },
  {
    "id": 698,
    "name": "Рекламные кампании",
    "description": "Рекламные кампании",
    "status": {
      "id": 0,
      "name": "Черновик",
      "color": "#3D3F46",
      "isActive": false,
      "hasDeadline": false,
      "isAppliedIndividually": false,
      "texts": [
        {
          "lang": "Ru",
          "name": "Черновик"
        },
        {
          "lang": "En",
          "name": "Draft"
        }
      ]
    },
    "assigner": {
      "id": "user:3",
      "name": "Вячеслав Фоменко"
    },
    "project": {
      "id": 116,
      "name": "Маркетинг"
    }
  },
  {
    "id": 699,
    "name": "Рекламные материалы",
    "description": "Рекламные материалы",
    "status": {
      "id": 0,
      "name": "Черновик",
      "color": "#3D3F46",
      "isActive": false,
      "hasDeadline": false,
      "isAppliedIndividually": false,
      "texts": [
        {
          "lang": "Ru",
          "name": "Черновик"
        },
        {
          "lang": "En",
          "name": "Draft"
        }
      ]
    },
    "assigner": {
      "id": "user:3",
      "name": "Вячеслав Фоменко"
    },
    "project": {
      "id": 116,
      "name": "Маркетинг"
    }
  },
  {
    "id": 700,
    "name": "Брендбук",
    "description": "Брендбук",
    "status": {
      "id": 0,
      "name": "Черновик",
      "color": "#3D3F46",
      "isActive": false,
      "hasDeadline": false,
      "isAppliedIndividually": false,
      "texts": [
        {
          "lang": "Ru",
          "name": "Черновик"
        },
        {
          "lang": "En",
          "name": "Draft"
        }
      ]
    },
    "assigner": {
      "id": "user:3",
      "name": "Вячеслав Фоменко"
    },
    "project": {
      "id": 116,
      "name": "Маркетинг"
    }
  },
  {
    "id": 701,
    "name": "I-Town",
    "description": "",
    "status": {
      "id": 0,
      "name": "Черновик",
      "color": "#3D3F46",
      "isActive": false,
      "hasDeadline": false,
      "isAppliedIndividually": false,
      "texts": [
        {
          "lang": "Ru",
          "name": "Черновик"
        },
        {
          "lang": "En",
          "name": "Draft"
        }
      ]
    },
    "assigner": {
      "id": "user:3",
      "name": "Вячеслав Фоменко"
    },
    "project": {
      "id": 116,
      "name": "Маркетинг"
    }
  },
  {
    "id": 702,
    "name": "Маркетинговая концепция и стратегия",
    "description": "Маркетинговая концепция и стратегия",
    "status": {
      "id": 0,
      "name": "Черновик",
      "color": "#3D3F46",
      "isActive": false,
      "hasDeadline": false,
      "isAppliedIndividually": false,
      "texts": [
        {
          "lang": "Ru",
          "name": "Черновик"
        },
        {
          "lang": "En",
          "name": "Draft"
        }
      ]
    },
    "assigner": {
      "id": "user:3",
      "name": "Вячеслав Фоменко"
    },
    "project": {
      "id": 116,
      "name": "Маркетинг"
    }
  },
  {
    "id": 703,
    "name": "Рекламные кампании",
    "description": "Рекламные кампании",
    "status": {
      "id": 0,
      "name": "Черновик",
      "color": "#3D3F46",
      "isActive": false,
      "hasDeadline": false,
      "isAppliedIndividually": false,
      "texts": [
        {
          "lang": "Ru",
          "name": "Черновик"
        },
        {
          "lang": "En",
          "name": "Draft"
        }
      ]
    },
    "assigner": {
      "id": "user:3",
      "name": "Вячеслав Фоменко"
    },
    "project": {
      "id": 116,
      "name": "Маркетинг"
    }
  },
  {
    "id": 704,
    "name": "Рекламные материалы",
    "description": "Рекламные материалы",
    "status": {
      "id": 0,
      "name": "Черновик",
      "color": "#3D3F46",
      "isActive": false,
      "hasDeadline": false,
      "isAppliedIndividually": false,
      "texts": [
        {
          "lang": "Ru",
          "name": "Черновик"
        },
        {
          "lang": "En",
          "name": "Draft"
        }
      ]
    },
    "assigner": {
      "id": "user:3",
      "name": "Вячеслав Фоменко"
    },
    "project": {
      "id": 116,
      "name": "Маркетинг"
    }
  },
  {
    "id": 705,
    "name": "Брендбук",
    "description": "Брендбук",
    "status": {
      "id": 0,
      "name": "Черновик",
      "color": "#3D3F46",
      "isActive": false,
      "hasDeadline": false,
      "isAppliedIndividually": false,
      "texts": [
        {
          "lang": "Ru",
          "name": "Черновик"
        },
        {
          "lang": "En",
          "name": "Draft"
        }
      ]
    },
    "assigner": {
      "id": "user:3",
      "name": "Вячеслав Фоменко"
    },
    "project": {
      "id": 116,
      "name": "Маркетинг"
    }
  },
  {
    "id": 706,
    "name": "Собрать данные о конкурентах",
    "description": "",
    "status": {
      "id": 2,
      "name": "В работе",
      "color": "#3377C3",
      "isActive": true,
      "hasDeadline": true,
      "isAppliedIndividually": false,
      "texts": [
        {
          "lang": "Ru",
          "name": "В работе"
        },
        {
          "lang": "En",
          "name": "In progress"
        }
      ]
    },
    "assigner": {
      "id": "user:3",
      "name": "Вячеслав Фоменко"
    },
    "project": {
      "id": 116,
      "name": "Маркетинг"
    }
  },
  {
    "id": 707,
    "name": "Разработать и запустить MVP портала",
    "description": "",
    "status": {
      "id": 2,
      "name": "В работе",
      "color": "#3377C3",
      "isActive": true,
      "hasDeadline": true,
      "isAppliedIndividually": false,
      "texts": [
        {
          "lang": "Ru",
          "name": "В работе"
        },
        {
          "lang": "En",
          "name": "In progress"
        }
      ]
    },
    "assigner": {
      "id": "user:3",
      "name": "Вячеслав Фоменко"
    },
    "project": {
      "id": 116,
      "name": "Маркетинг"
    },
    "endDateTime": {
      "date": "31-05-2025",
      "time": "00:00",
      "datetime": "2025-05-31T00:00Z"
    },
    "assignees": {
      "users": [
        {
          "id": "user:3",
          "name": "Вячеслав Фоменко"
        }
      ],
      "groups": []
    }
  },
  {
    "id": 709,
    "name": "Разработать полнофункциональный портал",
    "description": "",
    "status": {
      "id": 2,
      "name": "В работе",
      "color": "#3377C3",
      "isActive": true,
      "hasDeadline": true,
      "isAppliedIndividually": false,
      "texts": [
        {
          "lang": "Ru",
          "name": "В работе"
        },
        {
          "lang": "En",
          "name": "In progress"
        }
      ]
    },
    "assigner": {
      "id": "user:3",
      "name": "Вячеслав Фоменко"
    },
    "project": {
      "id": 116,
      "name": "Маркетинг"
    },
    "endDateTime": {
      "date": "31-05-2025",
      "time": "00:00",
      "datetime": "2025-05-31T00:00Z"
    },
    "assignees": {
      "users": [
        {
          "id": "user:3",
          "name": "Вячеслав Фоменко"
        }
      ],
      "groups": []
    }
  },
  {
    "id": 710,
    "name": "Согласовать организацию отдела продаж",
    "description": "",
    "status": {
      "id": 2,
      "name": "В работе",
      "color": "#3377C3",
      "isActive": true,
      "hasDeadline": true,
      "isAppliedIndividually": false,
      "texts": [
        {
          "lang": "Ru",
          "name": "В работе"
        },
        {
          "lang": "En",
          "name": "In progress"
        }
      ]
    },
    "assigner": {
      "id": "user:3",
      "name": "Вячеслав Фоменко"
    },
    "project": {
      "id": 116,
      "name": "Маркетинг"
    },
    "assignees": {
      "users": [
        {
          "id": "user:3",
          "name": "Вячеслав Фоменко"
        },
        {
          "id": "user:1",
          "name": "Константин Осипов"
        }
      ],
      "groups": []
    }
  },
  {
    "id": 717,
    "name": "Совещания с ИНД",
    "description": "",
    "status": {
      "id": 2,
      "name": "В работе",
      "color": "#3377C3",
      "isActive": true,
      "hasDeadline": true,
      "isAppliedIndividually": false,
      "texts": [
        {
          "lang": "Ru",
          "name": "В работе"
        },
        {
          "lang": "En",
          "name": "In progress"
        }
      ]
    },
    "assigner": {
      "id": "user:1",
      "name": "Константин Осипов"
    },
    "project": {
      "id": 29,
      "name": "Автовокзал"
    }
  },
  {
    "id": 720,
    "name": "Мегабудка",
    "description": "",
    "status": {
      "id": 1,
      "name": "Новая",
      "color": "#00b4b4",
      "isActive": true,
      "hasDeadline": true,
      "isAppliedIndividually": false,
      "texts": [
        {
          "lang": "Ru",
          "name": "Новая"
        },
        {
          "lang": "En",
          "name": "New"
        }
      ]
    },
    "assigner": {
      "id": "user:5",
      "name": "Алексей Шульга"
    },
    "project": {
      "id": 1647,
      "name": "Elysium Иссык-Куль"
    }
  },
  {
    "id": 721,
    "name": "Получить КП от Мегабудки",
    "description": "",
    "status": {
      "id": 2,
      "name": "В работе",
      "color": "#3377C3",
      "isActive": true,
      "hasDeadline": true,
      "isAppliedIndividually": false,
      "texts": [
        {
          "lang": "Ru",
          "name": "В работе"
        },
        {
          "lang": "En",
          "name": "In progress"
        }
      ]
    },
    "assigner": {
      "id": "user:5",
      "name": "Алексей Шульга"
    },
    "project": {
      "id": 1647,
      "name": "Elysium Иссык-Куль"
    },
    "assignees": {
      "users": [
        {
          "id": "user:1",
          "name": "Константин Осипов"
        }
      ],
      "groups": []
    }
  },
  {
    "id": 724,
    "name": "IHG",
    "description": "",
    "status": {
      "id": 2,
      "name": "В работе",
      "color": "#3377C3",
      "isActive": true,
      "hasDeadline": true,
      "isAppliedIndividually": false,
      "texts": [
        {
          "lang": "Ru",
          "name": "В работе"
        },
        {
          "lang": "En",
          "name": "In progress"
        }
      ]
    },
    "assigner": {
      "id": "user:5",
      "name": "Алексей Шульга"
    },
    "project": {
      "id": 12,
      "name": "Polaris Иссык-Куль"
    },
    "assignees": {
      "users": [
        {
          "id": "user:4",
          "name": "Назарий Шевченко"
        }
      ],
      "groups": []
    }
  },
  {
    "id": 725,
    "name": "Получить КП от IHG",
    "description": "",
    "status": {
      "id": 2,
      "name": "В работе",
      "color": "#3377C3",
      "isActive": true,
      "hasDeadline": true,
      "isAppliedIndividually": false,
      "texts": [
        {
          "lang": "Ru",
          "name": "В работе"
        },
        {
          "lang": "En",
          "name": "In progress"
        }
      ]
    },
    "assigner": {
      "id": "user:5",
      "name": "Алексей Шульга"
    },
    "project": {
      "id": 12,
      "name": "Polaris Иссык-Куль"
    },
    "assignees": {
      "users": [
        {
          "id": "user:5",
          "name": "Алексей Шульга"
        },
        {
          "id": "user:4",
          "name": "Назарий Шевченко"
        }
      ],
      "groups": []
    }
  },
  {
    "id": 726,
    "name": "Marriot",
    "description": "",
    "status": {
      "id": 2,
      "name": "В работе",
      "color": "#3377C3",
      "isActive": true,
      "hasDeadline": true,
      "isAppliedIndividually": false,
      "texts": [
        {
          "lang": "Ru",
          "name": "В работе"
        },
        {
          "lang": "En",
          "name": "In progress"
        }
      ]
    },
    "assigner": {
      "id": "user:5",
      "name": "Алексей Шульга"
    },
    "project": {
      "id": 12,
      "name": "Polaris Иссык-Куль"
    },
    "assignees": {
      "users": [
        {
          "id": "user:5",
          "name": "Алексей Шульга"
        },
        {
          "id": "user:4",
          "name": "Назарий Шевченко"
        }
      ],
      "groups": []
    }
  },
  {
    "id": 727,
    "name": "Получить КП от Marriot",
    "description": "",
    "status": {
      "id": 2,
      "name": "В работе",
      "color": "#3377C3",
      "isActive": true,
      "hasDeadline": true,
      "isAppliedIndividually": false,
      "texts": [
        {
          "lang": "Ru",
          "name": "В работе"
        },
        {
          "lang": "En",
          "name": "In progress"
        }
      ]
    },
    "assigner": {
      "id": "user:5",
      "name": "Алексей Шульга"
    },
    "project": {
      "id": 12,
      "name": "Polaris Иссык-Куль"
    },
    "assignees": {
      "users": [
        {
          "id": "user:5",
          "name": "Алексей Шульга"
        },
        {
          "id": "user:4",
          "name": "Назарий Шевченко"
        }
      ],
      "groups": []
    }
  },
  {
    "id": 729,
    "name": "Devent Development",
    "description": "",
    "status": {
      "id": 2,
      "name": "В работе",
      "color": "#3377C3",
      "isActive": true,
      "hasDeadline": true,
      "isAppliedIndividually": false,
      "texts": [
        {
          "lang": "Ru",
          "name": "В работе"
        },
        {
          "lang": "En",
          "name": "In progress"
        }
      ]
    },
    "assigner": {
      "id": "user:3",
      "name": "Вячеслав Фоменко"
    },
    "project": {
      "id": 116,
      "name": "Маркетинг"
    }
  },
  {
    "id": 730,
    "name": "Брендбук",
    "description": "",
    "status": {
      "id": 2,
      "name": "В работе",
      "color": "#3377C3",
      "isActive": true,
      "hasDeadline": true,
      "isAppliedIndividually": false,
      "texts": [
        {
          "lang": "Ru",
          "name": "В работе"
        },
        {
          "lang": "En",
          "name": "In progress"
        }
      ]
    },
    "assigner": {
      "id": "user:3",
      "name": "Вячеслав Фоменко"
    },
    "project": {
      "id": 116,
      "name": "Маркетинг"
    }
  },
  {
    "id": 731,
    "name": "Сайт-портал",
    "description": "",
    "status": {
      "id": 2,
      "name": "В работе",
      "color": "#3377C3",
      "isActive": true,
      "hasDeadline": true,
      "isAppliedIndividually": false,
      "texts": [
        {
          "lang": "Ru",
          "name": "В работе"
        },
        {
          "lang": "En",
          "name": "In progress"
        }
      ]
    },
    "assigner": {
      "id": "user:3",
      "name": "Вячеслав Фоменко"
    },
    "project": {
      "id": 116,
      "name": "Маркетинг"
    }
  },
  {
    "id": 732,
    "name": "Маркетинговая концепция и стратегия",
    "description": "",
    "status": {
      "id": 2,
      "name": "В работе",
      "color": "#3377C3",
      "isActive": true,
      "hasDeadline": true,
      "isAppliedIndividually": false,
      "texts": [
        {
          "lang": "Ru",
          "name": "В работе"
        },
        {
          "lang": "En",
          "name": "In progress"
        }
      ]
    },
    "assigner": {
      "id": "user:3",
      "name": "Вячеслав Фоменко"
    },
    "project": {
      "id": 116,
      "name": "Маркетинг"
    }
  },
  {
    "id": 733,
    "name": "Рекламные кампании",
    "description": "",
    "status": {
      "id": 2,
      "name": "В работе",
      "color": "#3377C3",
      "isActive": true,
      "hasDeadline": true,
      "isAppliedIndividually": false,
      "texts": [
        {
          "lang": "Ru",
          "name": "В работе"
        },
        {
          "lang": "En",
          "name": "In progress"
        }
      ]
    },
    "assigner": {
      "id": "user:3",
      "name": "Вячеслав Фоменко"
    },
    "project": {
      "id": 116,
      "name": "Маркетинг"
    }
  },
  {
    "id": 734,
    "name": "Отдел продаж",
    "description": "",
    "status": {
      "id": 2,
      "name": "В работе",
      "color": "#3377C3",
      "isActive": true,
      "hasDeadline": true,
      "isAppliedIndividually": false,
      "texts": [
        {
          "lang": "Ru",
          "name": "В работе"
        },
        {
          "lang": "En",
          "name": "In progress"
        }
      ]
    },
    "assigner": {
      "id": "user:3",
      "name": "Вячеслав Фоменко"
    },
    "project": {
      "id": 116,
      "name": "Маркетинг"
    }
  },
  {
    "id": 756,
    "name": "Создать структуру проектов и утвердить ее на уровне регралментов",
    "description": "",
    "status": {
      "id": 2,
      "name": "В работе",
      "color": "#3377C3",
      "isActive": true,
      "hasDeadline": true,
      "isAppliedIndividually": false,
      "texts": [
        {
          "lang": "Ru",
          "name": "В работе"
        },
        {
          "lang": "En",
          "name": "In progress"
        }
      ]
    },
    "assigner": {
      "id": "user:1",
      "name": "Константин Осипов"
    },
    "project": {
      "id": 23,
      "name": "Общие вопросы компании"
    },
    "startDateTime": {
      "date": "12-03-2025",
      "time": "00:00",
      "datetime": "2025-03-12T00:00Z"
    },
    "endDateTime": {
      "date": "23-05-2025",
      "time": "00:00",
      "datetime": "2025-05-23T00:00Z"
    },
    "assignees": {
      "users": [
        {
          "id": "user:5",
          "name": "Алексей Шульга"
        },
        {
          "id": "user:1",
          "name": "Константин Осипов"
        }
      ],
      "groups": []
    }
  },
  {
    "id": 759,
    "name": "Согласовать организацию отдела продаж, как аутстаф",
    "description": "<p>Есть видение организации отдела продаж, как аутстаф, который организует коммерческий директор, который тоже будет выступать подрядчиком, а не сотрудником.</p>\n<p>Предлагаю описать здесь такой вариант. И если он для нас приоритетный, значит надо сфоксироваться на поиске такого подрядчика.</p>",
    "status": {
      "id": 2,
      "name": "В работе",
      "color": "#3377C3",
      "isActive": true,
      "hasDeadline": true,
      "isAppliedIndividually": false,
      "texts": [
        {
          "lang": "Ru",
          "name": "В работе"
        },
        {
          "lang": "En",
          "name": "In progress"
        }
      ]
    },
    "assigner": {
      "id": "user:3",
      "name": "Вячеслав Фоменко"
    },
    "project": {
      "id": 116,
      "name": "Маркетинг"
    },
    "endDateTime": {
      "date": "30-04-2025",
      "time": "00:00",
      "datetime": "2025-04-30T00:00Z"
    },
    "assignees": {
      "users": [
        {
          "id": "user:3",
          "name": "Вячеслав Фоменко"
        },
        {
          "id": "user:1",
          "name": "Константин Осипов"
        }
      ],
      "groups": []
    }
  },
  {
    "id": 769,
    "name": "Выбор Генподрядчика",
    "description": "",
    "status": {
      "id": 2,
      "name": "В работе",
      "color": "#3377C3",
      "isActive": true,
      "hasDeadline": true,
      "isAppliedIndividually": false,
      "texts": [
        {
          "lang": "Ru",
          "name": "В работе"
        },
        {
          "lang": "En",
          "name": "In progress"
        }
      ]
    },
    "assigner": {
      "id": "user:5",
      "name": "Алексей Шульга"
    },
    "project": {
      "id": 29,
      "name": "Автовокзал"
    },
    "startDateTime": {
      "date": "02-05-2025",
      "time": "00:00",
      "datetime": "2025-05-02T00:00Z"
    },
    "endDateTime": {
      "date": "14-05-2025",
      "time": "00:00",
      "datetime": "2025-05-14T00:00Z"
    },
    "assignees": {
      "users": [
        {
          "id": "user:5",
          "name": "Алексей Шульга"
        }
      ],
      "groups": []
    }
  },
  {
    "id": 772,
    "name": "Капстрой",
    "description": "",
    "status": {
      "id": 2,
      "name": "В работе",
      "color": "#3377C3",
      "isActive": true,
      "hasDeadline": true,
      "isAppliedIndividually": false,
      "texts": [
        {
          "lang": "Ru",
          "name": "В работе"
        },
        {
          "lang": "En",
          "name": "In progress"
        }
      ]
    },
    "assigner": {
      "id": "user:5",
      "name": "Алексей Шульга"
    },
    "project": {
      "id": 29,
      "name": "Автовокзал"
    }
  },
  {
    "id": 773,
    "name": "Получить КП от Капстроя",
    "description": "",
    "status": {
      "id": 1,
      "name": "Новая",
      "color": "#00b4b4",
      "isActive": true,
      "hasDeadline": true,
      "isAppliedIndividually": false,
      "texts": [
        {
          "lang": "Ru",
          "name": "Новая"
        },
        {
          "lang": "En",
          "name": "New"
        }
      ]
    },
    "assigner": {
      "id": "user:5",
      "name": "Алексей Шульга"
    },
    "project": {
      "id": 29,
      "name": "Автовокзал"
    }
  },
  {
    "id": 854,
    "name": "БРОКЕР. Наполнение арендаторами",
    "description": "",
    "status": {
      "id": 2,
      "name": "В работе",
      "color": "#3377C3",
      "isActive": true,
      "hasDeadline": true,
      "isAppliedIndividually": false,
      "texts": [
        {
          "lang": "Ru",
          "name": "В работе"
        },
        {
          "lang": "En",
          "name": "In progress"
        }
      ]
    },
    "assigner": {
      "id": "user:5",
      "name": "Алексей Шульга"
    },
    "project": {
      "id": 29,
      "name": "Автовокзал"
    },
    "startDateTime": {
      "date": "02-05-2025",
      "time": "00:00",
      "datetime": "2025-05-02T00:00Z"
    },
    "endDateTime": {
      "date": "30-09-2025",
      "time": "00:00",
      "datetime": "2025-09-30T00:00Z"
    },
    "assignees": {
      "users": [
        {
          "id": "user:5",
          "name": "Алексей Шульга"
        }
      ],
      "groups": []
    }
  },
  {
    "id": 1014,
    "name": "Telegram",
    "description": "",
    "status": {
      "id": 2,
      "name": "В работе",
      "color": "#3377C3",
      "isActive": true,
      "hasDeadline": true,
      "isAppliedIndividually": false,
      "texts": [
        {
          "lang": "Ru",
          "name": "В работе"
        },
        {
          "lang": "En",
          "name": "In progress"
        }
      ]
    },
    "assigner": {
      "id": "user:9",
      "name": "Бахтияр Ибрагимов"
    }
  },
  {
    "id": 1054,
    "name": "Внедрении ИИ агентов во все процессы компании",
    "description": "<p>Внедрении ИИ агентов во все процессы компании, где это позволяет текущий уровень функционала ИИ</p>\n<p>&nbsp;</p>\n<ol>\n <li>Создать список-структуру этапов девелопмента компании.</li>\n <li>Дать deep research этот список на анализ, чтобы отметить все процессы, где можно внедрить ИИ \n  <ol>\n   <li>Должна быть оценка сложности внедрения, сколько потребуется времени, приоритет в плане эффективности</li>\n  </ol></li>\n <li>Обновить список с учётом выдачи</li>\n <li>Проработать каждый предложенный процесс в соответствии с приоритетом</li>\n <li>Найти подрядчика работающего с ИИ для внедрения этих процессов</li>\n</ol>",
    "status": {
      "id": 2,
      "name": "В работе",
      "color": "#3377C3",
      "isActive": true,
      "hasDeadline": true,
      "isAppliedIndividually": false,
      "texts": [
        {
          "lang": "Ru",
          "name": "В работе"
        },
        {
          "lang": "En",
          "name": "In progress"
        }
      ]
    },
    "assigner": {
      "id": "user:3",
      "name": "Вячеслав Фоменко"
    },
    "project": {
      "id": 23,
      "name": "Общие вопросы компании"
    },
    "assignees": {
      "users": [
        {
          "id": "user:3",
          "name": "Вячеслав Фоменко"
        },
        {
          "id": "user:1",
          "name": "Константин Осипов"
        }
      ],
      "groups": []
    }
  },
  {
    "id": 1062,
    "name": "Сделать ИИ агента/бота связь планфикса, гугл диска. Цель - поддержка сотрудников.",
    "description": "",
    "status": {
      "id": 2,
      "name": "В работе",
      "color": "#3377C3",
      "isActive": true,
      "hasDeadline": true,
      "isAppliedIndividually": false,
      "texts": [
        {
          "lang": "Ru",
          "name": "В работе"
        },
        {
          "lang": "En",
          "name": "In progress"
        }
      ]
    },
    "assigner": {
      "id": "user:1",
      "name": "Константин Осипов"
    },
    "project": {
      "id": 23,
      "name": "Общие вопросы компании"
    },
    "startDateTime": {
      "date": "17-03-2025",
      "time": "00:00",
      "datetime": "2025-03-17T00:00Z"
    },
    "endDateTime": {
      "date": "30-04-2025",
      "time": "00:00",
      "datetime": "2025-04-30T00:00Z"
    },
    "assignees": {
      "users": [
        {
          "id": "user:3",
          "name": "Вячеслав Фоменко"
        },
        {
          "id": "user:1",
          "name": "Константин Осипов"
        }
      ],
      "groups": []
    }
  },
  {
    "id": 1283,
    "name": "Создать список сетей которые подлежат переносу",
    "description": "",
    "status": {
      "id": 2,
      "name": "В работе",
      "color": "#3377C3",
      "isActive": true,
      "hasDeadline": true,
      "isAppliedIndividually": false,
      "texts": [
        {
          "lang": "Ru",
          "name": "В работе"
        },
        {
          "lang": "En",
          "name": "In progress"
        }
      ]
    },
    "assigner": {
      "id": "user:5",
      "name": "Алексей Шульга"
    },
    "project": {
      "id": 29,
      "name": "Автовокзал"
    },
    "startDateTime": {
      "date": "18-03-2025",
      "time": "00:00",
      "datetime": "2025-03-18T00:00Z"
    },
    "endDateTime": {
      "date": "02-05-2025",
      "time": "00:00",
      "datetime": "2025-05-02T00:00Z"
    },
    "assignees": {
      "users": [
        {
          "id": "user:7",
          "name": "Оксана Янковская"
        }
      ],
      "groups": []
    }
  },
  {
    "id": 1296,
    "name": "SkyPark",
    "description": "",
    "status": {
      "id": 2,
      "name": "В работе",
      "color": "#3377C3",
      "isActive": true,
      "hasDeadline": true,
      "isAppliedIndividually": false,
      "texts": [
        {
          "lang": "Ru",
          "name": "В работе"
        },
        {
          "lang": "En",
          "name": "In progress"
        }
      ]
    },
    "assigner": {
      "id": "user:1",
      "name": "Константин Осипов"
    },
    "project": {
      "id": 29,
      "name": "Автовокзал"
    },
    "startDateTime": {
      "date": "18-03-2025",
      "time": "00:00",
      "datetime": "2025-03-18T00:00Z"
    },
    "endDateTime": {
      "date": "31-05-2025",
      "time": "00:00",
      "datetime": "2025-05-31T00:00Z"
    }
  },
  {
    "id": 1297,
    "name": "Заключить Договор с Скай Парк",
    "description": "",
    "status": {
      "id": 2,
      "name": "В работе",
      "color": "#3377C3",
      "isActive": true,
      "hasDeadline": true,
      "isAppliedIndividually": false,
      "texts": [
        {
          "lang": "Ru",
          "name": "В работе"
        },
        {
          "lang": "En",
          "name": "In progress"
        }
      ]
    },
    "assigner": {
      "id": "user:1",
      "name": "Константин Осипов"
    },
    "project": {
      "id": 29,
      "name": "Автовокзал"
    },
    "startDateTime": {
      "date": "18-03-2025",
      "time": "00:00",
      "datetime": "2025-03-18T00:00Z"
    },
    "endDateTime": {
      "date": "17-05-2025",
      "time": "00:00",
      "datetime": "2025-05-17T00:00Z"
    },
    "assignees": {
      "users": [
        {
          "id": "user:5",
          "name": "Алексей Шульга"
        },
        {
          "id": "user:1",
          "name": "Константин Осипов"
        }
      ],
      "groups": []
    }
  },
  {
    "id": 1309,
    "name": "Baytur Resort",
    "description": "",
    "status": {
      "id": 1,
      "name": "Новая",
      "color": "#00b4b4",
      "isActive": true,
      "hasDeadline": true,
      "isAppliedIndividually": false,
      "texts": [
        {
          "lang": "Ru",
          "name": "Новая"
        },
        {
          "lang": "En",
          "name": "New"
        }
      ]
    },
    "assigner": {
      "id": "user:5",
      "name": "Алексей Шульга"
    },
    "project": {
      "id": 23,
      "name": "Общие вопросы компании"
    }
  },
  {
    "id": 1311,
    "name": "1. ЗЕМЛЯ И ДОКУМЕНЕТЫ НА ЗЕМЛЮ",
    "description": "",
    "status": {
      "id": 2,
      "name": "В работе",
      "color": "#3377C3",
      "isActive": true,
      "hasDeadline": true,
      "isAppliedIndividually": false,
      "texts": [
        {
          "lang": "Ru",
          "name": "В работе"
        },
        {
          "lang": "En",
          "name": "In progress"
        }
      ]
    },
    "assigner": {
      "id": "user:1",
      "name": "Константин Осипов"
    },
    "project": {
      "id": 1310,
      "name": "Строительство Тазалыка №1"
    },
    "startDateTime": {
      "date": "06-02-2025",
      "time": "00:00",
      "datetime": "2025-02-06T00:00Z"
    },
    "endDateTime": {
      "date": "24-05-2025",
      "time": "00:00",
      "datetime": "2025-05-24T00:00Z"
    },
    "assignees": {
      "users": [
        {
          "id": "user:20",
          "name": "Канатбек Аскаров"
        }
      ],
      "groups": []
    }
  },
  {
    "id": 1313,
    "name": "3. ПРОЕКТНО-РАЗРЕШИТЕЛЬНАЯ ДОКУМЕНТАЦИЯ",
    "description": "",
    "status": {
      "id": 2,
      "name": "В работе",
      "color": "#3377C3",
      "isActive": true,
      "hasDeadline": true,
      "isAppliedIndividually": false,
      "texts": [
        {
          "lang": "Ru",
          "name": "В работе"
        },
        {
          "lang": "En",
          "name": "In progress"
        }
      ]
    },
    "assigner": {
      "id": "user:1",
      "name": "Константин Осипов"
    },
    "project": {
      "id": 1310,
      "name": "Строительство Тазалыка №1"
    },
    "startDateTime": {
      "date": "21-03-2025",
      "time": "08:00",
      "datetime": "2025-03-21T08:00Z"
    },
    "endDateTime": {
      "date": "18-08-2025",
      "time": "00:00",
      "datetime": "2025-08-18T00:00Z"
    },
    "assignees": {
      "users": [
        {
          "id": "user:20",
          "name": "Канатбек Аскаров"
        }
      ],
      "groups": []
    }
  },
  {
    "id": 1315,
    "name": "2. Получение / оформление прав на землю",
    "description": "",
    "status": {
      "id": 1,
      "name": "Новая",
      "color": "#00b4b4",
      "isActive": true,
      "hasDeadline": true,
      "isAppliedIndividually": false,
      "texts": [
        {
          "lang": "Ru",
          "name": "Новая"
        },
        {
          "lang": "En",
          "name": "New"
        }
      ]
    },
    "assigner": {
      "id": "user:1",
      "name": "Константин Осипов"
    },
    "project": {
      "id": 1310,
      "name": "Строительство Тазалыка №1"
    },
    "startDateTime": {
      "date": "24-03-2025",
      "time": "00:00",
      "datetime": "2025-03-24T00:00Z"
    },
    "endDateTime": {
      "date": "24-05-2025",
      "time": "00:00",
      "datetime": "2025-05-24T00:00Z"
    }
  },
  {
    "id": 1316,
    "name": "Этап 3. Подготовка и организация строительства",
    "description": "",
    "status": {
      "id": 0,
      "name": "Черновик",
      "color": "#3D3F46",
      "isActive": false,
      "hasDeadline": false,
      "isAppliedIndividually": false,
      "texts": [
        {
          "lang": "Ru",
          "name": "Черновик"
        },
        {
          "lang": "En",
          "name": "Draft"
        }
      ]
    },
    "assigner": {
      "id": "user:1",
      "name": "Константин Осипов"
    },
    "project": {
      "id": 1310,
      "name": "Строительство Тазалыка №1"
    },
    "startDateTime": {
      "date": "14-08-2025",
      "time": "05:31",
      "datetime": "2025-08-14T05:31Z"
    },
    "endDateTime": {
      "date": "01-09-2025",
      "time": "05:31",
      "datetime": "2025-09-01T05:31Z"
    }
  },
  {
    "id": 1319,
    "name": "1. Выбрать и нанять Генподрядчика",
    "description": "",
    "status": {
      "id": 2,
      "name": "В работе",
      "color": "#3377C3",
      "isActive": true,
      "hasDeadline": true,
      "isAppliedIndividually": false,
      "texts": [
        {
          "lang": "Ru",
          "name": "В работе"
        },
        {
          "lang": "En",
          "name": "In progress"
        }
      ]
    },
    "assigner": {
      "id": "user:1",
      "name": "Константин Осипов"
    },
    "project": {
      "id": 1310,
      "name": "Строительство Тазалыка №1"
    }
  },
  {
    "id": 1320,
    "name": "1. Выбрать и привлечь Генпроектировщика",
    "description": "",
    "status": {
      "id": 2,
      "name": "В работе",
      "color": "#3377C3",
      "isActive": true,
      "hasDeadline": true,
      "isAppliedIndividually": false,
      "texts": [
        {
          "lang": "Ru",
          "name": "В работе"
        },
        {
          "lang": "En",
          "name": "In progress"
        }
      ]
    },
    "assigner": {
      "id": "user:1",
      "name": "Константин Осипов"
    },
    "project": {
      "id": 1310,
      "name": "Строительство Тазалыка №1"
    },
    "startDateTime": {
      "date": "29-04-2025",
      "time": "00:00",
      "datetime": "2025-04-29T00:00Z"
    },
    "endDateTime": {
      "date": "17-05-2025",
      "time": "00:00",
      "datetime": "2025-05-17T00:00Z"
    },
    "assignees": {
      "users": [
        {
          "id": "user:5",
          "name": "Алексей Шульга"
        }
      ],
      "groups": []
    }
  },
  {
    "id": 1321,
    "name": "2. Разработать архитектурную концепцию и проектную документацию",
    "description": "",
    "status": {
      "id": 0,
      "name": "Черновик",
      "color": "#3D3F46",
      "isActive": false,
      "hasDeadline": false,
      "isAppliedIndividually": false,
      "texts": [
        {
          "lang": "Ru",
          "name": "Черновик"
        },
        {
          "lang": "En",
          "name": "Draft"
        }
      ]
    },
    "assigner": {
      "id": "user:1",
      "name": "Константин Осипов"
    },
    "project": {
      "id": 1310,
      "name": "Строительство Тазалыка №1"
    },
    "startDateTime": {
      "date": "19-05-2025",
      "time": "00:00",
      "datetime": "2025-05-19T00:00Z"
    },
    "endDateTime": {
      "date": "05-08-2025",
      "time": "00:00",
      "datetime": "2025-08-05T00:00Z"
    }
  },
  {
    "id": 1323,
    "name": "4. Провести инженерно-изыскательские работы",
    "description": "",
    "status": {
      "id": 2,
      "name": "В работе",
      "color": "#3377C3",
      "isActive": true,
      "hasDeadline": true,
      "isAppliedIndividually": false,
      "texts": [
        {
          "lang": "Ru",
          "name": "В работе"
        },
        {
          "lang": "En",
          "name": "In progress"
        }
      ]
    },
    "assigner": {
      "id": "user:1",
      "name": "Константин Осипов"
    },
    "project": {
      "id": 1310,
      "name": "Строительство Тазалыка №1"
    },
    "assignees": {
      "users": [
        {
          "id": "user:20",
          "name": "Канатбек Аскаров"
        }
      ],
      "groups": []
    }
  },
  {
    "id": 1325,
    "name": "1.1 Подготовить и провести тендер",
    "description": "",
    "status": {
      "id": 2,
      "name": "В работе",
      "color": "#3377C3",
      "isActive": true,
      "hasDeadline": true,
      "isAppliedIndividually": false,
      "texts": [
        {
          "lang": "Ru",
          "name": "В работе"
        },
        {
          "lang": "En",
          "name": "In progress"
        }
      ]
    },
    "assigner": {
      "id": "user:1",
      "name": "Константин Осипов"
    },
    "project": {
      "id": 1310,
      "name": "Строительство Тазалыка №1"
    },
    "assignees": {
      "users": [
        {
          "id": "user:5",
          "name": "Алексей Шульга"
        }
      ],
      "groups": []
    }
  },
  {
    "id": 1326,
    "name": "4.1 Провести топосъемку",
    "description": "<p>Уточнить что есть. Оксана Игоревна знает</p>",
    "status": {
      "id": 2,
      "name": "В работе",
      "color": "#3377C3",
      "isActive": true,
      "hasDeadline": true,
      "isAppliedIndividually": false,
      "texts": [
        {
          "lang": "Ru",
          "name": "В работе"
        },
        {
          "lang": "En",
          "name": "In progress"
        }
      ]
    },
    "assigner": {
      "id": "user:1",
      "name": "Константин Осипов"
    },
    "project": {
      "id": 1310,
      "name": "Строительство Тазалыка №1"
    },
    "assignees": {
      "users": [
        {
          "id": "user:20",
          "name": "Канатбек Аскаров"
        }
      ],
      "groups": []
    }
  },
  {
    "id": 1327,
    "name": "2.2 Детализировать проектные решения по основным разделам",
    "description": "",
    "status": {
      "id": 0,
      "name": "Черновик",
      "color": "#3D3F46",
      "isActive": false,
      "hasDeadline": false,
      "isAppliedIndividually": false,
      "texts": [
        {
          "lang": "Ru",
          "name": "Черновик"
        },
        {
          "lang": "En",
          "name": "Draft"
        }
      ]
    },
    "assigner": {
      "id": "user:1",
      "name": "Константин Осипов"
    },
    "project": {
      "id": 1310,
      "name": "Строительство Тазалыка №1"
    }
  },
  {
    "id": 1328,
    "name": "4. Запланировать и координировать работы",
    "description": "",
    "status": {
      "id": 0,
      "name": "Черновик",
      "color": "#3D3F46",
      "isActive": false,
      "hasDeadline": false,
      "isAppliedIndividually": false,
      "texts": [
        {
          "lang": "Ru",
          "name": "Черновик"
        },
        {
          "lang": "En",
          "name": "Draft"
        }
      ]
    },
    "assigner": {
      "id": "user:1",
      "name": "Константин Осипов"
    },
    "project": {
      "id": 1310,
      "name": "Строительство Тазалыка №1"
    }
  },
  {
    "id": 1330,
    "name": "2.1 Разработать и утвердить архитектурную концепцию с учетом градостроительных норм",
    "description": "",
    "status": {
      "id": 0,
      "name": "Черновик",
      "color": "#3D3F46",
      "isActive": false,
      "hasDeadline": false,
      "isAppliedIndividually": false,
      "texts": [
        {
          "lang": "Ru",
          "name": "Черновик"
        },
        {
          "lang": "En",
          "name": "Draft"
        }
      ]
    },
    "assigner": {
      "id": "user:1",
      "name": "Константин Осипов"
    },
    "project": {
      "id": 1310,
      "name": "Строительство Тазалыка №1"
    }
  },
  {
    "id": 1331,
    "name": "3. Организовать охрану площадки",
    "description": "",
    "status": {
      "id": 0,
      "name": "Черновик",
      "color": "#3D3F46",
      "isActive": false,
      "hasDeadline": false,
      "isAppliedIndividually": false,
      "texts": [
        {
          "lang": "Ru",
          "name": "Черновик"
        },
        {
          "lang": "En",
          "name": "Draft"
        }
      ]
    },
    "assigner": {
      "id": "user:1",
      "name": "Константин Осипов"
    },
    "project": {
      "id": 1310,
      "name": "Строительство Тазалыка №1"
    }
  },
  {
    "id": 1332,
    "name": "4.1 Разработать график выполнения строительных работ совместно с Генподрядчиком и субподрядчиками",
    "description": "",
    "status": {
      "id": 0,
      "name": "Черновик",
      "color": "#3D3F46",
      "isActive": false,
      "hasDeadline": false,
      "isAppliedIndividually": false,
      "texts": [
        {
          "lang": "Ru",
          "name": "Черновик"
        },
        {
          "lang": "En",
          "name": "Draft"
        }
      ]
    },
    "assigner": {
      "id": "user:1",
      "name": "Константин Осипов"
    },
    "project": {
      "id": 1310,
      "name": "Строительство Тазалыка №1"
    }
  },
  {
    "id": 1333,
    "name": "3. Организовать экспертизу и получить разрешения",
    "description": "",
    "status": {
      "id": 0,
      "name": "Черновик",
      "color": "#3D3F46",
      "isActive": false,
      "hasDeadline": false,
      "isAppliedIndividually": false,
      "texts": [
        {
          "lang": "Ru",
          "name": "Черновик"
        },
        {
          "lang": "En",
          "name": "Draft"
        }
      ]
    },
    "assigner": {
      "id": "user:1",
      "name": "Константин Осипов"
    },
    "project": {
      "id": 1310,
      "name": "Строительство Тазалыка №1"
    },
    "startDateTime": {
      "date": "06-08-2025",
      "time": "00:00",
      "datetime": "2025-08-06T00:00Z"
    },
    "endDateTime": {
      "date": "18-08-2025",
      "time": "00:00",
      "datetime": "2025-08-18T00:00Z"
    }
  },
  {
    "id": 1334,
    "name": "1.2 Заключить договор с Генпроектировщиком (или проектным консорциумом)",
    "description": "",
    "status": {
      "id": 1,
      "name": "Новая",
      "color": "#00b4b4",
      "isActive": true,
      "hasDeadline": true,
      "isAppliedIndividually": false,
      "texts": [
        {
          "lang": "Ru",
          "name": "Новая"
        },
        {
          "lang": "En",
          "name": "New"
        }
      ]
    },
    "assigner": {
      "id": "user:1",
      "name": "Константин Осипов"
    },
    "project": {
      "id": 1310,
      "name": "Строительство Тазалыка №1"
    }
  },
  {
    "id": 1335,
    "name": "1.3 Заключить договор генподряда с выбранной организацией",
    "description": "",
    "status": {
      "id": 0,
      "name": "Черновик",
      "color": "#3D3F46",
      "isActive": false,
      "hasDeadline": false,
      "isAppliedIndividually": false,
      "texts": [
        {
          "lang": "Ru",
          "name": "Черновик"
        },
        {
          "lang": "En",
          "name": "Draft"
        }
      ]
    },
    "assigner": {
      "id": "user:1",
      "name": "Константин Осипов"
    },
    "project": {
      "id": 1310,
      "name": "Строительство Тазалыка №1"
    }
  },
  {
    "id": 1336,
    "name": "4.2 Выполнить инженерно-геологические изыскания",
    "description": "<p>Уточнить у Улана когда это нужно сделать и в каком объёме, Желательно не делать вообще!</p>",
    "status": {
      "id": 2,
      "name": "В работе",
      "color": "#3377C3",
      "isActive": true,
      "hasDeadline": true,
      "isAppliedIndividually": false,
      "texts": [
        {
          "lang": "Ru",
          "name": "В работе"
        },
        {
          "lang": "En",
          "name": "In progress"
        }
      ]
    },
    "assigner": {
      "id": "user:1",
      "name": "Константин Осипов"
    },
    "project": {
      "id": 1310,
      "name": "Строительство Тазалыка №1"
    },
    "assignees": {
      "users": [
        {
          "id": "user:20",
          "name": "Канатбек Аскаров"
        }
      ],
      "groups": []
    }
  },
  {
    "id": 1338,
    "name": "3.2 Устранить замечания и внести корректировки по итогам экспертизы",
    "description": "",
    "status": {
      "id": 0,
      "name": "Черновик",
      "color": "#3D3F46",
      "isActive": false,
      "hasDeadline": false,
      "isAppliedIndividually": false,
      "texts": [
        {
          "lang": "Ru",
          "name": "Черновик"
        },
        {
          "lang": "En",
          "name": "Draft"
        }
      ]
    },
    "assigner": {
      "id": "user:1",
      "name": "Константин Осипов"
    },
    "project": {
      "id": 1310,
      "name": "Строительство Тазалыка №1"
    }
  },
  {
    "id": 1339,
    "name": "2. Установить забор",
    "description": "",
    "status": {
      "id": 0,
      "name": "Черновик",
      "color": "#3D3F46",
      "isActive": false,
      "hasDeadline": false,
      "isAppliedIndividually": false,
      "texts": [
        {
          "lang": "Ru",
          "name": "Черновик"
        },
        {
          "lang": "En",
          "name": "Draft"
        }
      ]
    },
    "assigner": {
      "id": "user:1",
      "name": "Константин Осипов"
    },
    "project": {
      "id": 1310,
      "name": "Строительство Тазалыка №1"
    },
    "startDateTime": {
      "date": "14-08-2025",
      "time": "05:31",
      "datetime": "2025-08-14T05:31Z"
    },
    "endDateTime": {
      "date": "01-09-2025",
      "time": "05:31",
      "datetime": "2025-09-01T05:31Z"
    }
  },
  {
    "id": 1340,
    "name": "4.3 Утвердить план организации строительной площадки и временных коммуникаций",
    "description": "",
    "status": {
      "id": 0,
      "name": "Черновик",
      "color": "#3D3F46",
      "isActive": false,
      "hasDeadline": false,
      "isAppliedIndividually": false,
      "texts": [
        {
          "lang": "Ru",
          "name": "Черновик"
        },
        {
          "lang": "En",
          "name": "Draft"
        }
      ]
    },
    "assigner": {
      "id": "user:1",
      "name": "Константин Осипов"
    },
    "project": {
      "id": 1310,
      "name": "Строительство Тазалыка №1"
    }
  },
  {
    "id": 1341,
    "name": "0.1 Сформировать бюджет проекта",
    "description": "",
    "status": {
      "id": 2,
      "name": "В работе",
      "color": "#3377C3",
      "isActive": true,
      "hasDeadline": true,
      "isAppliedIndividually": false,
      "texts": [
        {
          "lang": "Ru",
          "name": "В работе"
        },
        {
          "lang": "En",
          "name": "In progress"
        }
      ]
    },
    "assigner": {
      "id": "user:1",
      "name": "Константин Осипов"
    },
    "project": {
      "id": 1310,
      "name": "Строительство Тазалыка №1"
    },
    "startDateTime": {
      "date": "09-06-2025",
      "time": "00:00",
      "datetime": "2025-06-09T00:00Z"
    },
    "endDateTime": {
      "date": "21-06-2025",
      "time": "00:00",
      "datetime": "2025-06-21T00:00Z"
    },
    "assignees": {
      "users": [
        {
          "id": "user:20",
          "name": "Канатбек Аскаров"
        }
      ],
      "groups": []
    }
  },
  {
    "id": 1342,
    "name": "4.2 Организовать снабжение и логистику",
    "description": "",
    "status": {
      "id": 0,
      "name": "Черновик",
      "color": "#3D3F46",
      "isActive": false,
      "hasDeadline": false,
      "isAppliedIndividually": false,
      "texts": [
        {
          "lang": "Ru",
          "name": "Черновик"
        },
        {
          "lang": "En",
          "name": "Draft"
        }
      ]
    },
    "assigner": {
      "id": "user:1",
      "name": "Константин Осипов"
    },
    "project": {
      "id": 1310,
      "name": "Строительство Тазалыка №1"
    }
  },
  {
    "id": 1344,
    "name": "2.3 Получить технические условия на подключение к сетям инженерно-технического обеспечения",
    "description": "",
    "status": {
      "id": 0,
      "name": "Черновик",
      "color": "#3D3F46",
      "isActive": false,
      "hasDeadline": false,
      "isAppliedIndividually": false,
      "texts": [
        {
          "lang": "Ru",
          "name": "Черновик"
        },
        {
          "lang": "En",
          "name": "Draft"
        }
      ]
    },
    "assigner": {
      "id": "user:1",
      "name": "Константин Осипов"
    },
    "project": {
      "id": 1310,
      "name": "Строительство Тазалыка №1"
    }
  },
  {
    "id": 1345,
    "name": "3.4.1 Разработать предварительный бюджет",
    "description": "",
    "status": {
      "id": 1,
      "name": "Новая",
      "color": "#00b4b4",
      "isActive": true,
      "hasDeadline": true,
      "isAppliedIndividually": false,
      "texts": [
        {
          "lang": "Ru",
          "name": "Новая"
        },
        {
          "lang": "En",
          "name": "New"
        }
      ]
    },
    "assigner": {
      "id": "user:1",
      "name": "Константин Осипов"
    },
    "project": {
      "id": 1310,
      "name": "Строительство Тазалыка №1"
    }
  },
  {
    "id": 1347,
    "name": "5. Выполнить подготовительные строительные работы",
    "description": "",
    "status": {
      "id": 0,
      "name": "Черновик",
      "color": "#3D3F46",
      "isActive": false,
      "hasDeadline": false,
      "isAppliedIndividually": false,
      "texts": [
        {
          "lang": "Ru",
          "name": "Черновик"
        },
        {
          "lang": "En",
          "name": "Draft"
        }
      ]
    },
    "assigner": {
      "id": "user:1",
      "name": "Константин Осипов"
    },
    "project": {
      "id": 1310,
      "name": "Строительство Тазалыка №1"
    }
  },
  {
    "id": 1348,
    "name": "1.1 Подготовить и провести тендер или выбрать проектную организацию напрямую",
    "description": "",
    "status": {
      "id": 2,
      "name": "В работе",
      "color": "#3377C3",
      "isActive": true,
      "hasDeadline": true,
      "isAppliedIndividually": false,
      "texts": [
        {
          "lang": "Ru",
          "name": "В работе"
        },
        {
          "lang": "En",
          "name": "In progress"
        }
      ]
    },
    "assigner": {
      "id": "user:1",
      "name": "Константин Осипов"
    },
    "project": {
      "id": 1310,
      "name": "Строительство Тазалыка №1"
    },
    "assignees": {
      "users": [
        {
          "id": "user:20",
          "name": "Канатбек Аскаров"
        }
      ],
      "groups": []
    }
  },
  {
    "id": 1349,
    "name": "3.3 Получить положительное заключение экспертизы и оформить разрешения на строительство",
    "description": "",
    "status": {
      "id": 0,
      "name": "Черновик",
      "color": "#3D3F46",
      "isActive": false,
      "hasDeadline": false,
      "isAppliedIndividually": false,
      "texts": [
        {
          "lang": "Ru",
          "name": "Черновик"
        },
        {
          "lang": "En",
          "name": "Draft"
        }
      ]
    },
    "assigner": {
      "id": "user:1",
      "name": "Константин Осипов"
    },
    "project": {
      "id": 1310,
      "name": "Строительство Тазалыка №1"
    }
  },
  {
    "id": 1350,
    "name": "1.3 Согласовать технические задания и ключевые показатели проекта",
    "description": "<p><a href=\"https://docs.google.com/document/d/1QccT8NyG19SE5axvH5VEYy9P6oY-0qOZzMsvAD0kXTQ/edit?usp=sharing\">https://docs.google.com/document/d/1QccT8NyG19SE5axvH5VEYy9P6oY-0qOZzMsvAD0kXTQ/edit?usp=sharing</a></p>",
    "status": {
      "id": 2,
      "name": "В работе",
      "color": "#3377C3",
      "isActive": true,
      "hasDeadline": true,
      "isAppliedIndividually": false,
      "texts": [
        {
          "lang": "Ru",
          "name": "В работе"
        },
        {
          "lang": "En",
          "name": "In progress"
        }
      ]
    },
    "assigner": {
      "id": "user:1",
      "name": "Константин Осипов"
    },
    "project": {
      "id": 1310,
      "name": "Строительство Тазалыка №1"
    },
    "startDateTime": {
      "date": "29-04-2025",
      "time": "00:00",
      "datetime": "2025-04-29T00:00Z"
    },
    "endDateTime": {
      "date": "17-05-2025",
      "time": "00:00",
      "datetime": "2025-05-17T00:00Z"
    },
    "assignees": {
      "users": [
        {
          "id": "user:5",
          "name": "Алексей Шульга"
        },
        {
          "id": "user:7",
          "name": "Оксана Янковская"
        }
      ],
      "groups": []
    }
  },
  {
    "id": 1351,
    "name": "Этап 5. Ввод в эксплуатацию и закрытие проекта",
    "description": "",
    "status": {
      "id": 0,
      "name": "Черновик",
      "color": "#3D3F46",
      "isActive": false,
      "hasDeadline": false,
      "isAppliedIndividually": false,
      "texts": [
        {
          "lang": "Ru",
          "name": "Черновик"
        },
        {
          "lang": "En",
          "name": "Draft"
        }
      ]
    },
    "assigner": {
      "id": "user:1",
      "name": "Константин Осипов"
    },
    "project": {
      "id": 1310,
      "name": "Строительство Тазалыка №1"
    },
    "startDateTime": {
      "date": "01-12-2025",
      "time": "00:00",
      "datetime": "2025-12-01T00:00Z"
    },
    "endDateTime": {
      "date": "03-01-2026",
      "time": "00:00",
      "datetime": "2026-01-03T00:00Z"
    }
  },
  {
    "id": 1352,
    "name": "3.4.2 Утвердить бюджет с инвесторами/руководством",
    "description": "",
    "status": {
      "id": 1,
      "name": "Новая",
      "color": "#00b4b4",
      "isActive": true,
      "hasDeadline": true,
      "isAppliedIndividually": false,
      "texts": [
        {
          "lang": "Ru",
          "name": "Новая"
        },
        {
          "lang": "En",
          "name": "New"
        }
      ]
    },
    "assigner": {
      "id": "user:1",
      "name": "Константин Осипов"
    },
    "project": {
      "id": 1310,
      "name": "Строительство Тазалыка №1"
    }
  },
  {
    "id": 1354,
    "name": "1.2 Проанализировать и сравнить коммерческие предложения, согласовать сметные расчёты",
    "description": "",
    "status": {
      "id": 0,
      "name": "Черновик",
      "color": "#3D3F46",
      "isActive": false,
      "hasDeadline": false,
      "isAppliedIndividually": false,
      "texts": [
        {
          "lang": "Ru",
          "name": "Черновик"
        },
        {
          "lang": "En",
          "name": "Draft"
        }
      ]
    },
    "assigner": {
      "id": "user:1",
      "name": "Константин Осипов"
    },
    "project": {
      "id": 1310,
      "name": "Строительство Тазалыка №1"
    }
  },
  {
    "id": 1355,
    "name": "3.1 Провести экспертизу проектной документации",
    "description": "",
    "status": {
      "id": 0,
      "name": "Черновик",
      "color": "#3D3F46",
      "isActive": false,
      "hasDeadline": false,
      "isAppliedIndividually": false,
      "texts": [
        {
          "lang": "Ru",
          "name": "Черновик"
        },
        {
          "lang": "En",
          "name": "Draft"
        }
      ]
    },
    "assigner": {
      "id": "user:1",
      "name": "Константин Осипов"
    },
    "project": {
      "id": 1310,
      "name": "Строительство Тазалыка №1"
    }
  },
  {
    "id": 1356,
    "name": "Этап 4. Строительство и монтажные работы",
    "description": "",
    "status": {
      "id": 0,
      "name": "Черновик",
      "color": "#3D3F46",
      "isActive": false,
      "hasDeadline": false,
      "isAppliedIndividually": false,
      "texts": [
        {
          "lang": "Ru",
          "name": "Черновик"
        },
        {
          "lang": "En",
          "name": "Draft"
        }
      ]
    },
    "assigner": {
      "id": "user:1",
      "name": "Константин Осипов"
    },
    "project": {
      "id": 1310,
      "name": "Строительство Тазалыка №1"
    }
  },
  {
    "id": 1357,
    "name": "5.1 Запустить временную инфраструктуру",
    "description": "",
    "status": {
      "id": 0,
      "name": "Черновик",
      "color": "#3D3F46",
      "isActive": false,
      "hasDeadline": false,
      "isAppliedIndividually": false,
      "texts": [
        {
          "lang": "Ru",
          "name": "Черновик"
        },
        {
          "lang": "En",
          "name": "Draft"
        }
      ]
    },
    "assigner": {
      "id": "user:1",
      "name": "Константин Осипов"
    },
    "project": {
      "id": 1310,
      "name": "Строительство Тазалыка №1"
    }
  },
  {
    "id": 1358,
    "name": "1. Выполнить основной цикл строительных работ",
    "description": "",
    "status": {
      "id": 1,
      "name": "Новая",
      "color": "#00b4b4",
      "isActive": true,
      "hasDeadline": true,
      "isAppliedIndividually": false,
      "texts": [
        {
          "lang": "Ru",
          "name": "Новая"
        },
        {
          "lang": "En",
          "name": "New"
        }
      ]
    },
    "assigner": {
      "id": "user:1",
      "name": "Константин Осипов"
    },
    "project": {
      "id": 1310,
      "name": "Строительство Тазалыка №1"
    },
    "startDateTime": {
      "date": "02-09-2025",
      "time": "00:00",
      "datetime": "2025-09-02T00:00Z"
    },
    "endDateTime": {
      "date": "06-04-2026",
      "time": "00:00",
      "datetime": "2026-04-06T00:00Z"
    }
  },
  {
    "id": 1359,
    "name": "1. Выполнить окончательную приёмку и ввести в эксплуатацию",
    "description": "",
    "status": {
      "id": 0,
      "name": "Черновик",
      "color": "#3D3F46",
      "isActive": false,
      "hasDeadline": false,
      "isAppliedIndividually": false,
      "texts": [
        {
          "lang": "Ru",
          "name": "Черновик"
        },
        {
          "lang": "En",
          "name": "Draft"
        }
      ]
    },
    "assigner": {
      "id": "user:1",
      "name": "Константин Осипов"
    },
    "project": {
      "id": 1310,
      "name": "Строительство Тазалыка №1"
    }
  },
  {
    "id": 1360,
    "name": "1.1 Возвести несущие конструкции",
    "description": "",
    "status": {
      "id": 0,
      "name": "Черновик",
      "color": "#3D3F46",
      "isActive": false,
      "hasDeadline": false,
      "isAppliedIndividually": false,
      "texts": [
        {
          "lang": "Ru",
          "name": "Черновик"
        },
        {
          "lang": "En",
          "name": "Draft"
        }
      ]
    },
    "assigner": {
      "id": "user:1",
      "name": "Константин Осипов"
    },
    "project": {
      "id": 1310,
      "name": "Строительство Тазалыка №1"
    }
  },
  {
    "id": 1361,
    "name": "2. Управлять проектом и осуществлять надзор",
    "description": "",
    "status": {
      "id": 0,
      "name": "Черновик",
      "color": "#3D3F46",
      "isActive": false,
      "hasDeadline": false,
      "isAppliedIndividually": false,
      "texts": [
        {
          "lang": "Ru",
          "name": "Черновик"
        },
        {
          "lang": "En",
          "name": "Draft"
        }
      ]
    },
    "assigner": {
      "id": "user:1",
      "name": "Константин Осипов"
    },
    "project": {
      "id": 1310,
      "name": "Строительство Тазалыка №1"
    }
  },
  {
    "id": 1362,
    "name": "5.3 Контролировать соблюдение норм техники безопасности и охраны труда",
    "description": "",
    "status": {
      "id": 0,
      "name": "Черновик",
      "color": "#3D3F46",
      "isActive": false,
      "hasDeadline": false,
      "isAppliedIndividually": false,
      "texts": [
        {
          "lang": "Ru",
          "name": "Черновик"
        },
        {
          "lang": "En",
          "name": "Draft"
        }
      ]
    },
    "assigner": {
      "id": "user:1",
      "name": "Константин Осипов"
    },
    "project": {
      "id": 1310,
      "name": "Строительство Тазалыка №1"
    }
  },
  {
    "id": 1363,
    "name": "1.1 Организовать итоговую приёмочную комиссию",
    "description": "",
    "status": {
      "id": 0,
      "name": "Черновик",
      "color": "#3D3F46",
      "isActive": false,
      "hasDeadline": false,
      "isAppliedIndividually": false,
      "texts": [
        {
          "lang": "Ru",
          "name": "Черновик"
        },
        {
          "lang": "En",
          "name": "Draft"
        }
      ]
    },
    "assigner": {
      "id": "user:1",
      "name": "Константин Осипов"
    },
    "project": {
      "id": 1310,
      "name": "Строительство Тазалыка №1"
    }
  },
  {
    "id": 1364,
    "name": "1.2 Смонтировать инженерные системы",
    "description": "",
    "status": {
      "id": 0,
      "name": "Черновик",
      "color": "#3D3F46",
      "isActive": false,
      "hasDeadline": false,
      "isAppliedIndividually": false,
      "texts": [
        {
          "lang": "Ru",
          "name": "Черновик"
        },
        {
          "lang": "En",
          "name": "Draft"
        }
      ]
    },
    "assigner": {
      "id": "user:1",
      "name": "Константин Осипов"
    },
    "project": {
      "id": 1310,
      "name": "Строительство Тазалыка №1"
    }
  },
  {
    "id": 1365,
    "name": "3. Завершить и проанализировать проект",
    "description": "",
    "status": {
      "id": 0,
      "name": "Черновик",
      "color": "#3D3F46",
      "isActive": false,
      "hasDeadline": false,
      "isAppliedIndividually": false,
      "texts": [
        {
          "lang": "Ru",
          "name": "Черновик"
        },
        {
          "lang": "En",
          "name": "Draft"
        }
      ]
    },
    "assigner": {
      "id": "user:1",
      "name": "Константин Осипов"
    },
    "project": {
      "id": 1310,
      "name": "Строительство Тазалыка №1"
    }
  },
  {
    "id": 1366,
    "name": "2.1 Организовать технический надзор",
    "description": "",
    "status": {
      "id": 0,
      "name": "Черновик",
      "color": "#3D3F46",
      "isActive": false,
      "hasDeadline": false,
      "isAppliedIndividually": false,
      "texts": [
        {
          "lang": "Ru",
          "name": "Черновик"
        },
        {
          "lang": "En",
          "name": "Draft"
        }
      ]
    },
    "assigner": {
      "id": "user:1",
      "name": "Константин Осипов"
    },
    "project": {
      "id": 1310,
      "name": "Строительство Тазалыка №1"
    }
  },
  {
    "id": 1367,
    "name": "5.2 Провести земляные работы, вынести инженерные сети, подготовить фундамент",
    "description": "",
    "status": {
      "id": 0,
      "name": "Черновик",
      "color": "#3D3F46",
      "isActive": false,
      "hasDeadline": false,
      "isAppliedIndividually": false,
      "texts": [
        {
          "lang": "Ru",
          "name": "Черновик"
        },
        {
          "lang": "En",
          "name": "Draft"
        }
      ]
    },
    "assigner": {
      "id": "user:1",
      "name": "Константин Осипов"
    },
    "project": {
      "id": 1310,
      "name": "Строительство Тазалыка №1"
    }
  },
  {
    "id": 1368,
    "name": "1.2 Получить заключительные акты, сертификаты и согласования",
    "description": "",
    "status": {
      "id": 0,
      "name": "Черновик",
      "color": "#3D3F46",
      "isActive": false,
      "hasDeadline": false,
      "isAppliedIndividually": false,
      "texts": [
        {
          "lang": "Ru",
          "name": "Черновик"
        },
        {
          "lang": "En",
          "name": "Draft"
        }
      ]
    },
    "assigner": {
      "id": "user:1",
      "name": "Константин Осипов"
    },
    "project": {
      "id": 1310,
      "name": "Строительство Тазалыка №1"
    }
  },
  {
    "id": 1369,
    "name": "3.1 Подготовить финансовый отчёт",
    "description": "",
    "status": {
      "id": 0,
      "name": "Черновик",
      "color": "#3D3F46",
      "isActive": false,
      "hasDeadline": false,
      "isAppliedIndividually": false,
      "texts": [
        {
          "lang": "Ru",
          "name": "Черновик"
        },
        {
          "lang": "En",
          "name": "Draft"
        }
      ]
    },
    "assigner": {
      "id": "user:1",
      "name": "Константин Осипов"
    },
    "project": {
      "id": 1310,
      "name": "Строительство Тазалыка №1"
    }
  },
  {
    "id": 1370,
    "name": "2. Собрать и передать исполнительную документацию",
    "description": "",
    "status": {
      "id": 0,
      "name": "Черновик",
      "color": "#3D3F46",
      "isActive": false,
      "hasDeadline": false,
      "isAppliedIndividually": false,
      "texts": [
        {
          "lang": "Ru",
          "name": "Черновик"
        },
        {
          "lang": "En",
          "name": "Draft"
        }
      ]
    },
    "assigner": {
      "id": "user:1",
      "name": "Константин Осипов"
    },
    "project": {
      "id": 1310,
      "name": "Строительство Тазалыка №1"
    }
  },
  {
    "id": 1371,
    "name": "3. Выполнить промежуточные приёмочные процедуры",
    "description": "",
    "status": {
      "id": 0,
      "name": "Черновик",
      "color": "#3D3F46",
      "isActive": false,
      "hasDeadline": false,
      "isAppliedIndividually": false,
      "texts": [
        {
          "lang": "Ru",
          "name": "Черновик"
        },
        {
          "lang": "En",
          "name": "Draft"
        }
      ]
    },
    "assigner": {
      "id": "user:1",
      "name": "Константин Осипов"
    },
    "project": {
      "id": 1310,
      "name": "Строительство Тазалыка №1"
    }
  },
  {
    "id": 1372,
    "name": "1.3 Подписать акты приёмки с инвесторами, эксплуатирующими организациями",
    "description": "",
    "status": {
      "id": 0,
      "name": "Черновик",
      "color": "#3D3F46",
      "isActive": false,
      "hasDeadline": false,
      "isAppliedIndividually": false,
      "texts": [
        {
          "lang": "Ru",
          "name": "Черновик"
        },
        {
          "lang": "En",
          "name": "Draft"
        }
      ]
    },
    "assigner": {
      "id": "user:1",
      "name": "Константин Осипов"
    },
    "project": {
      "id": 1310,
      "name": "Строительство Тазалыка №1"
    }
  },
  {
    "id": 1373,
    "name": "1.3 Произвести внешнюю и внутреннюю отделку, благоустроить территорию",
    "description": "",
    "status": {
      "id": 0,
      "name": "Черновик",
      "color": "#3D3F46",
      "isActive": false,
      "hasDeadline": false,
      "isAppliedIndividually": false,
      "texts": [
        {
          "lang": "Ru",
          "name": "Черновик"
        },
        {
          "lang": "En",
          "name": "Draft"
        }
      ]
    },
    "assigner": {
      "id": "user:1",
      "name": "Константин Осипов"
    },
    "project": {
      "id": 1310,
      "name": "Строительство Тазалыка №1"
    }
  },
  {
    "id": 1374,
    "name": "2.1 Собрать и проверить исполнительную документацию",
    "description": "",
    "status": {
      "id": 0,
      "name": "Черновик",
      "color": "#3D3F46",
      "isActive": false,
      "hasDeadline": false,
      "isAppliedIndividually": false,
      "texts": [
        {
          "lang": "Ru",
          "name": "Черновик"
        },
        {
          "lang": "En",
          "name": "Draft"
        }
      ]
    },
    "assigner": {
      "id": "user:1",
      "name": "Константин Осипов"
    },
    "project": {
      "id": 1310,
      "name": "Строительство Тазалыка №1"
    }
  },
  {
    "id": 1375,
    "name": "3.1 Провести тестирование и пуско-наладку инженерных систем",
    "description": "",
    "status": {
      "id": 0,
      "name": "Черновик",
      "color": "#3D3F46",
      "isActive": false,
      "hasDeadline": false,
      "isAppliedIndividually": false,
      "texts": [
        {
          "lang": "Ru",
          "name": "Черновик"
        },
        {
          "lang": "En",
          "name": "Draft"
        }
      ]
    },
    "assigner": {
      "id": "user:1",
      "name": "Константин Осипов"
    },
    "project": {
      "id": 1310,
      "name": "Строительство Тазалыка №1"
    }
  },
  {
    "id": 1376,
    "name": "2.3 Управлять изменениями",
    "description": "",
    "status": {
      "id": 0,
      "name": "Черновик",
      "color": "#3D3F46",
      "isActive": false,
      "hasDeadline": false,
      "isAppliedIndividually": false,
      "texts": [
        {
          "lang": "Ru",
          "name": "Черновик"
        },
        {
          "lang": "En",
          "name": "Draft"
        }
      ]
    },
    "assigner": {
      "id": "user:1",
      "name": "Константин Осипов"
    },
    "project": {
      "id": 1310,
      "name": "Строительство Тазалыка №1"
    }
  },
  {
    "id": 1377,
    "name": "2.2 Передать документацию инвесторам, управляющей или эксплуатирующей компании",
    "description": "",
    "status": {
      "id": 0,
      "name": "Черновик",
      "color": "#3D3F46",
      "isActive": false,
      "hasDeadline": false,
      "isAppliedIndividually": false,
      "texts": [
        {
          "lang": "Ru",
          "name": "Черновик"
        },
        {
          "lang": "En",
          "name": "Draft"
        }
      ]
    },
    "assigner": {
      "id": "user:1",
      "name": "Константин Осипов"
    },
    "project": {
      "id": 1310,
      "name": "Строительство Тазалыка №1"
    }
  },
  {
    "id": 1378,
    "name": "3.3 Закрыть административные и финансовые вопросы",
    "description": "",
    "status": {
      "id": 0,
      "name": "Черновик",
      "color": "#3D3F46",
      "isActive": false,
      "hasDeadline": false,
      "isAppliedIndividually": false,
      "texts": [
        {
          "lang": "Ru",
          "name": "Черновик"
        },
        {
          "lang": "En",
          "name": "Draft"
        }
      ]
    },
    "assigner": {
      "id": "user:1",
      "name": "Константин Осипов"
    },
    "project": {
      "id": 1310,
      "name": "Строительство Тазалыка №1"
    }
  },
  {
    "id": 1379,
    "name": "3.2 Устранить дефекты по результатам промежуточных осмотров",
    "description": "",
    "status": {
      "id": 0,
      "name": "Черновик",
      "color": "#3D3F46",
      "isActive": false,
      "hasDeadline": false,
      "isAppliedIndividually": false,
      "texts": [
        {
          "lang": "Ru",
          "name": "Черновик"
        },
        {
          "lang": "En",
          "name": "Draft"
        }
      ]
    },
    "assigner": {
      "id": "user:1",
      "name": "Константин Осипов"
    },
    "project": {
      "id": 1310,
      "name": "Строительство Тазалыка №1"
    }
  },
  {
    "id": 1380,
    "name": "2.2 Организовать авторский надзор",
    "description": "",
    "status": {
      "id": 0,
      "name": "Черновик",
      "color": "#3D3F46",
      "isActive": false,
      "hasDeadline": false,
      "isAppliedIndividually": false,
      "texts": [
        {
          "lang": "Ru",
          "name": "Черновик"
        },
        {
          "lang": "En",
          "name": "Draft"
        }
      ]
    },
    "assigner": {
      "id": "user:1",
      "name": "Константин Осипов"
    },
    "project": {
      "id": 1310,
      "name": "Строительство Тазалыка №1"
    }
  },
  {
    "id": 1381,
    "name": "2.3 Сформировать гарантийные обязательства перед заказчиком/инвестором",
    "description": "",
    "status": {
      "id": 0,
      "name": "Черновик",
      "color": "#3D3F46",
      "isActive": false,
      "hasDeadline": false,
      "isAppliedIndividually": false,
      "texts": [
        {
          "lang": "Ru",
          "name": "Черновик"
        },
        {
          "lang": "En",
          "name": "Draft"
        }
      ]
    },
    "assigner": {
      "id": "user:1",
      "name": "Константин Осипов"
    },
    "project": {
      "id": 1310,
      "name": "Строительство Тазалыка №1"
    }
  },
  {
    "id": 1382,
    "name": "3.3 Подготовиться к итоговой приемке и вводу в эксплуатацию",
    "description": "",
    "status": {
      "id": 0,
      "name": "Черновик",
      "color": "#3D3F46",
      "isActive": false,
      "hasDeadline": false,
      "isAppliedIndividually": false,
      "texts": [
        {
          "lang": "Ru",
          "name": "Черновик"
        },
        {
          "lang": "En",
          "name": "Draft"
        }
      ]
    },
    "assigner": {
      "id": "user:1",
      "name": "Константин Осипов"
    },
    "project": {
      "id": 1310,
      "name": "Строительство Тазалыка №1"
    }
  },
  {
    "id": 1383,
    "name": "2.4 Проводить еженедельные совещания с участниками проекта",
    "description": "",
    "status": {
      "id": 0,
      "name": "Черновик",
      "color": "#3D3F46",
      "isActive": false,
      "hasDeadline": false,
      "isAppliedIndividually": false,
      "texts": [
        {
          "lang": "Ru",
          "name": "Черновик"
        },
        {
          "lang": "En",
          "name": "Draft"
        }
      ]
    },
    "assigner": {
      "id": "user:1",
      "name": "Константин Осипов"
    },
    "project": {
      "id": 1310,
      "name": "Строительство Тазалыка №1"
    }
  },
  {
    "id": 1384,
    "name": "3.2 Проанализировать результаты по срокам, качеству, стоимости",
    "description": "",
    "status": {
      "id": 0,
      "name": "Черновик",
      "color": "#3D3F46",
      "isActive": false,
      "hasDeadline": false,
      "isAppliedIndividually": false,
      "texts": [
        {
          "lang": "Ru",
          "name": "Черновик"
        },
        {
          "lang": "En",
          "name": "Draft"
        }
      ]
    },
    "assigner": {
      "id": "user:1",
      "name": "Константин Осипов"
    },
    "project": {
      "id": 1310,
      "name": "Строительство Тазалыка №1"
    }
  },
  {
    "id": 1387,
    "name": "Этап 1. Инициация проекта и получение прав на землю",
    "description": "",
    "status": {
      "id": 1,
      "name": "Новая",
      "color": "#00b4b4",
      "isActive": true,
      "hasDeadline": true,
      "isAppliedIndividually": false,
      "texts": [
        {
          "lang": "Ru",
          "name": "Новая"
        },
        {
          "lang": "En",
          "name": "New"
        }
      ]
    },
    "assigner": {
      "id": "user:1",
      "name": "Константин Осипов"
    },
    "project": {
      "id": 1386,
      "name": "Строительство Тазалыка №2"
    }
  },
  {
    "id": 1388,
    "name": "1. Предварительный анализ и выбор участка",
    "description": "",
    "status": {
      "id": 1,
      "name": "Новая",
      "color": "#00b4b4",
      "isActive": true,
      "hasDeadline": true,
      "isAppliedIndividually": false,
      "texts": [
        {
          "lang": "Ru",
          "name": "Новая"
        },
        {
          "lang": "En",
          "name": "New"
        }
      ]
    },
    "assigner": {
      "id": "user:1",
      "name": "Константин Осипов"
    },
    "project": {
      "id": 1386,
      "name": "Строительство Тазалыка №2"
    }
  },
  {
    "id": 1389,
    "name": "1.1 Подготовить маркетинговое и экономическое обоснование",
    "description": "",
    "status": {
      "id": 1,
      "name": "Новая",
      "color": "#00b4b4",
      "isActive": true,
      "hasDeadline": true,
      "isAppliedIndividually": false,
      "texts": [
        {
          "lang": "Ru",
          "name": "Новая"
        },
        {
          "lang": "En",
          "name": "New"
        }
      ]
    },
    "assigner": {
      "id": "user:1",
      "name": "Константин Осипов"
    },
    "project": {
      "id": 1386,
      "name": "Строительство Тазалыка №2"
    }
  },
  {
    "id": 1390,
    "name": "2. Получение / оформление прав на землю",
    "description": "",
    "status": {
      "id": 1,
      "name": "Новая",
      "color": "#00b4b4",
      "isActive": true,
      "hasDeadline": true,
      "isAppliedIndividually": false,
      "texts": [
        {
          "lang": "Ru",
          "name": "Новая"
        },
        {
          "lang": "En",
          "name": "New"
        }
      ]
    },
    "assigner": {
      "id": "user:1",
      "name": "Константин Осипов"
    },
    "project": {
      "id": 1386,
      "name": "Строительство Тазалыка №2"
    }
  },
  {
    "id": 1391,
    "name": "Этап 2. Разработка и согласование проектно-разрешительной документации",
    "description": "",
    "status": {
      "id": 1,
      "name": "Новая",
      "color": "#00b4b4",
      "isActive": true,
      "hasDeadline": true,
      "isAppliedIndividually": false,
      "texts": [
        {
          "lang": "Ru",
          "name": "Новая"
        },
        {
          "lang": "En",
          "name": "New"
        }
      ]
    },
    "assigner": {
      "id": "user:1",
      "name": "Константин Осипов"
    },
    "project": {
      "id": 1386,
      "name": "Строительство Тазалыка №2"
    }
  },
  {
    "id": 1392,
    "name": "Этап 3. Подготовка и организация строительства",
    "description": "",
    "status": {
      "id": 1,
      "name": "Новая",
      "color": "#00b4b4",
      "isActive": true,
      "hasDeadline": true,
      "isAppliedIndividually": false,
      "texts": [
        {
          "lang": "Ru",
          "name": "Новая"
        },
        {
          "lang": "En",
          "name": "New"
        }
      ]
    },
    "assigner": {
      "id": "user:1",
      "name": "Константин Осипов"
    },
    "project": {
      "id": 1386,
      "name": "Строительство Тазалыка №2"
    }
  },
  {
    "id": 1393,
    "name": "3. Формирование общей концепции проекта",
    "description": "",
    "status": {
      "id": 1,
      "name": "Новая",
      "color": "#00b4b4",
      "isActive": true,
      "hasDeadline": true,
      "isAppliedIndividually": false,
      "texts": [
        {
          "lang": "Ru",
          "name": "Новая"
        },
        {
          "lang": "En",
          "name": "New"
        }
      ]
    },
    "assigner": {
      "id": "user:1",
      "name": "Константин Осипов"
    },
    "project": {
      "id": 1386,
      "name": "Строительство Тазалыка №2"
    }
  },
  {
    "id": 1394,
    "name": "1. Выбрать и привлечь Генпроектировщика",
    "description": "",
    "status": {
      "id": 1,
      "name": "Новая",
      "color": "#00b4b4",
      "isActive": true,
      "hasDeadline": true,
      "isAppliedIndividually": false,
      "texts": [
        {
          "lang": "Ru",
          "name": "Новая"
        },
        {
          "lang": "En",
          "name": "New"
        }
      ]
    },
    "assigner": {
      "id": "user:1",
      "name": "Константин Осипов"
    },
    "project": {
      "id": 1386,
      "name": "Строительство Тазалыка №2"
    }
  },
  {
    "id": 1395,
    "name": "1.3 Оценить инженерно-геологические условия и потенциальные риски",
    "description": "",
    "status": {
      "id": 1,
      "name": "Новая",
      "color": "#00b4b4",
      "isActive": true,
      "hasDeadline": true,
      "isAppliedIndividually": false,
      "texts": [
        {
          "lang": "Ru",
          "name": "Новая"
        },
        {
          "lang": "En",
          "name": "New"
        }
      ]
    },
    "assigner": {
      "id": "user:1",
      "name": "Константин Осипов"
    },
    "project": {
      "id": 1386,
      "name": "Строительство Тазалыка №2"
    }
  },
  {
    "id": 1396,
    "name": "1. Выбрать и нанять Генподрядчика",
    "description": "",
    "status": {
      "id": 1,
      "name": "Новая",
      "color": "#00b4b4",
      "isActive": true,
      "hasDeadline": true,
      "isAppliedIndividually": false,
      "texts": [
        {
          "lang": "Ru",
          "name": "Новая"
        },
        {
          "lang": "En",
          "name": "New"
        }
      ]
    },
    "assigner": {
      "id": "user:1",
      "name": "Константин Осипов"
    },
    "project": {
      "id": 1386,
      "name": "Строительство Тазалыка №2"
    }
  },
  {
    "id": 1397,
    "name": "3.1 Определить цели и основные параметры проекта",
    "description": "",
    "status": {
      "id": 1,
      "name": "Новая",
      "color": "#00b4b4",
      "isActive": true,
      "hasDeadline": true,
      "isAppliedIndividually": false,
      "texts": [
        {
          "lang": "Ru",
          "name": "Новая"
        },
        {
          "lang": "En",
          "name": "New"
        }
      ]
    },
    "assigner": {
      "id": "user:1",
      "name": "Константин Осипов"
    },
    "project": {
      "id": 1386,
      "name": "Строительство Тазалыка №2"
    }
  },
  {
    "id": 1398,
    "name": "4. Провести инженерно-изыскательские работы",
    "description": "",
    "status": {
      "id": 1,
      "name": "Новая",
      "color": "#00b4b4",
      "isActive": true,
      "hasDeadline": true,
      "isAppliedIndividually": false,
      "texts": [
        {
          "lang": "Ru",
          "name": "Новая"
        },
        {
          "lang": "En",
          "name": "New"
        }
      ]
    },
    "assigner": {
      "id": "user:1",
      "name": "Константин Осипов"
    },
    "project": {
      "id": 1386,
      "name": "Строительство Тазалыка №2"
    }
  },
  {
    "id": 1399,
    "name": "2.1 Провести переговоры с собственниками или государственными органами",
    "description": "",
    "status": {
      "id": 1,
      "name": "Новая",
      "color": "#00b4b4",
      "isActive": true,
      "hasDeadline": true,
      "isAppliedIndividually": false,
      "texts": [
        {
          "lang": "Ru",
          "name": "Новая"
        },
        {
          "lang": "En",
          "name": "New"
        }
      ]
    },
    "assigner": {
      "id": "user:1",
      "name": "Константин Осипов"
    },
    "project": {
      "id": 1386,
      "name": "Строительство Тазалыка №2"
    }
  },
  {
    "id": 1400,
    "name": "1.1 Подготовить и провести тендер или выбрать проектную организацию напрямую",
    "description": "",
    "status": {
      "id": 1,
      "name": "Новая",
      "color": "#00b4b4",
      "isActive": true,
      "hasDeadline": true,
      "isAppliedIndividually": false,
      "texts": [
        {
          "lang": "Ru",
          "name": "Новая"
        },
        {
          "lang": "En",
          "name": "New"
        }
      ]
    },
    "assigner": {
      "id": "user:1",
      "name": "Константин Осипов"
    },
    "project": {
      "id": 1386,
      "name": "Строительство Тазалыка №2"
    }
  },
  {
    "id": 1401,
    "name": "2. Разработать архитектурную концепцию и проектную документацию",
    "description": "",
    "status": {
      "id": 1,
      "name": "Новая",
      "color": "#00b4b4",
      "isActive": true,
      "hasDeadline": true,
      "isAppliedIndividually": false,
      "texts": [
        {
          "lang": "Ru",
          "name": "Новая"
        },
        {
          "lang": "En",
          "name": "New"
        }
      ]
    },
    "assigner": {
      "id": "user:1",
      "name": "Константин Осипов"
    },
    "project": {
      "id": 1386,
      "name": "Строительство Тазалыка №2"
    }
  },
  {
    "id": 1402,
    "name": "1.1 Подготовить и провести тендер",
    "description": "",
    "status": {
      "id": 1,
      "name": "Новая",
      "color": "#00b4b4",
      "isActive": true,
      "hasDeadline": true,
      "isAppliedIndividually": false,
      "texts": [
        {
          "lang": "Ru",
          "name": "Новая"
        },
        {
          "lang": "En",
          "name": "New"
        }
      ]
    },
    "assigner": {
      "id": "user:1",
      "name": "Константин Осипов"
    },
    "project": {
      "id": 1386,
      "name": "Строительство Тазалыка №2"
    }
  },
  {
    "id": 1403,
    "name": "2. Установить забор",
    "description": "",
    "status": {
      "id": 1,
      "name": "Новая",
      "color": "#00b4b4",
      "isActive": true,
      "hasDeadline": true,
      "isAppliedIndividually": false,
      "texts": [
        {
          "lang": "Ru",
          "name": "Новая"
        },
        {
          "lang": "En",
          "name": "New"
        }
      ]
    },
    "assigner": {
      "id": "user:1",
      "name": "Константин Осипов"
    },
    "project": {
      "id": 1386,
      "name": "Строительство Тазалыка №2"
    }
  },
  {
    "id": 1404,
    "name": "Этап 4. Строительство и монтажные работы",
    "description": "",
    "status": {
      "id": 1,
      "name": "Новая",
      "color": "#00b4b4",
      "isActive": true,
      "hasDeadline": true,
      "isAppliedIndividually": false,
      "texts": [
        {
          "lang": "Ru",
          "name": "Новая"
        },
        {
          "lang": "En",
          "name": "New"
        }
      ]
    },
    "assigner": {
      "id": "user:1",
      "name": "Константин Осипов"
    },
    "project": {
      "id": 1386,
      "name": "Строительство Тазалыка №2"
    }
  },
  {
    "id": 1405,
    "name": "4.2 Выполнить инженерно-изыскательские работы",
    "description": "",
    "status": {
      "id": 1,
      "name": "Новая",
      "color": "#00b4b4",
      "isActive": true,
      "hasDeadline": true,
      "isAppliedIndividually": false,
      "texts": [
        {
          "lang": "Ru",
          "name": "Новая"
        },
        {
          "lang": "En",
          "name": "New"
        }
      ]
    },
    "assigner": {
      "id": "user:1",
      "name": "Константин Осипов"
    },
    "project": {
      "id": 1386,
      "name": "Строительство Тазалыка №2"
    }
  },
  {
    "id": 1406,
    "name": "1.3 Заключить договор генподряда с выбранной организацией",
    "description": "",
    "status": {
      "id": 1,
      "name": "Новая",
      "color": "#00b4b4",
      "isActive": true,
      "hasDeadline": true,
      "isAppliedIndividually": false,
      "texts": [
        {
          "lang": "Ru",
          "name": "Новая"
        },
        {
          "lang": "En",
          "name": "New"
        }
      ]
    },
    "assigner": {
      "id": "user:1",
      "name": "Константин Осипов"
    },
    "project": {
      "id": 1386,
      "name": "Строительство Тазалыка №2"
    }
  },
  {
    "id": 1407,
    "name": "1.3 Согласовать технические задания и ключевые показатели проекта",
    "description": "",
    "status": {
      "id": 1,
      "name": "Новая",
      "color": "#00b4b4",
      "isActive": true,
      "hasDeadline": true,
      "isAppliedIndividually": false,
      "texts": [
        {
          "lang": "Ru",
          "name": "Новая"
        },
        {
          "lang": "En",
          "name": "New"
        }
      ]
    },
    "assigner": {
      "id": "user:1",
      "name": "Константин Осипов"
    },
    "project": {
      "id": 1386,
      "name": "Строительство Тазалыка №2"
    }
  },
  {
    "id": 1408,
    "name": "2. Управлять проектом и осуществлять надзор",
    "description": "",
    "status": {
      "id": 1,
      "name": "Новая",
      "color": "#00b4b4",
      "isActive": true,
      "hasDeadline": true,
      "isAppliedIndividually": false,
      "texts": [
        {
          "lang": "Ru",
          "name": "Новая"
        },
        {
          "lang": "En",
          "name": "New"
        }
      ]
    },
    "assigner": {
      "id": "user:1",
      "name": "Константин Осипов"
    },
    "project": {
      "id": 1386,
      "name": "Строительство Тазалыка №2"
    }
  },
  {
    "id": 1409,
    "name": "3.2 Определить основных заинтересованных сторон",
    "description": "",
    "status": {
      "id": 1,
      "name": "Новая",
      "color": "#00b4b4",
      "isActive": true,
      "hasDeadline": true,
      "isAppliedIndividually": false,
      "texts": [
        {
          "lang": "Ru",
          "name": "Новая"
        },
        {
          "lang": "En",
          "name": "New"
        }
      ]
    },
    "assigner": {
      "id": "user:1",
      "name": "Константин Осипов"
    },
    "project": {
      "id": 1386,
      "name": "Строительство Тазалыка №2"
    }
  },
  {
    "id": 1410,
    "name": "2.3 Получить технические условия на подключение к сетям инженерно-технического обеспечения",
    "description": "",
    "status": {
      "id": 1,
      "name": "Новая",
      "color": "#00b4b4",
      "isActive": true,
      "hasDeadline": true,
      "isAppliedIndividually": false,
      "texts": [
        {
          "lang": "Ru",
          "name": "Новая"
        },
        {
          "lang": "En",
          "name": "New"
        }
      ]
    },
    "assigner": {
      "id": "user:1",
      "name": "Константин Осипов"
    },
    "project": {
      "id": 1386,
      "name": "Строительство Тазалыка №2"
    }
  },
  {
    "id": 1411,
    "name": "Этап 5. Ввод в эксплуатацию и закрытие проекта",
    "description": "",
    "status": {
      "id": 1,
      "name": "Новая",
      "color": "#00b4b4",
      "isActive": true,
      "hasDeadline": true,
      "isAppliedIndividually": false,
      "texts": [
        {
          "lang": "Ru",
          "name": "Новая"
        },
        {
          "lang": "En",
          "name": "New"
        }
      ]
    },
    "assigner": {
      "id": "user:1",
      "name": "Константин Осипов"
    },
    "project": {
      "id": 1386,
      "name": "Строительство Тазалыка №2"
    }
  },
  {
    "id": 1412,
    "name": "3.3 Составить предварительный график проекта",
    "description": "",
    "status": {
      "id": 1,
      "name": "Новая",
      "color": "#00b4b4",
      "isActive": true,
      "hasDeadline": true,
      "isAppliedIndividually": false,
      "texts": [
        {
          "lang": "Ru",
          "name": "Новая"
        },
        {
          "lang": "En",
          "name": "New"
        }
      ]
    },
    "assigner": {
      "id": "user:1",
      "name": "Константин Осипов"
    },
    "project": {
      "id": 1386,
      "name": "Строительство Тазалыка №2"
    }
  },
  {
    "id": 1413,
    "name": "1.2 Проанализировать и сравнить коммерческие предложения, согласовать сметные расчёты",
    "description": "",
    "status": {
      "id": 1,
      "name": "Новая",
      "color": "#00b4b4",
      "isActive": true,
      "hasDeadline": true,
      "isAppliedIndividually": false,
      "texts": [
        {
          "lang": "Ru",
          "name": "Новая"
        },
        {
          "lang": "En",
          "name": "New"
        }
      ]
    },
    "assigner": {
      "id": "user:1",
      "name": "Константин Осипов"
    },
    "project": {
      "id": 1386,
      "name": "Строительство Тазалыка №2"
    }
  },
  {
    "id": 1414,
    "name": "5. Выполнить подготовительные строительные работы",
    "description": "",
    "status": {
      "id": 1,
      "name": "Новая",
      "color": "#00b4b4",
      "isActive": true,
      "hasDeadline": true,
      "isAppliedIndividually": false,
      "texts": [
        {
          "lang": "Ru",
          "name": "Новая"
        },
        {
          "lang": "En",
          "name": "New"
        }
      ]
    },
    "assigner": {
      "id": "user:1",
      "name": "Константин Осипов"
    },
    "project": {
      "id": 1386,
      "name": "Строительство Тазалыка №2"
    }
  },
  {
    "id": 1415,
    "name": "3. Выполнить промежуточные приёмочные процедуры",
    "description": "",
    "status": {
      "id": 1,
      "name": "Новая",
      "color": "#00b4b4",
      "isActive": true,
      "hasDeadline": true,
      "isAppliedIndividually": false,
      "texts": [
        {
          "lang": "Ru",
          "name": "Новая"
        },
        {
          "lang": "En",
          "name": "New"
        }
      ]
    },
    "assigner": {
      "id": "user:1",
      "name": "Константин Осипов"
    },
    "project": {
      "id": 1386,
      "name": "Строительство Тазалыка №2"
    }
  },
  {
    "id": 1416,
    "name": "2.2 Детализировать проектные решения по основным разделам",
    "description": "",
    "status": {
      "id": 1,
      "name": "Новая",
      "color": "#00b4b4",
      "isActive": true,
      "hasDeadline": true,
      "isAppliedIndividually": false,
      "texts": [
        {
          "lang": "Ru",
          "name": "Новая"
        },
        {
          "lang": "En",
          "name": "New"
        }
      ]
    },
    "assigner": {
      "id": "user:1",
      "name": "Константин Осипов"
    },
    "project": {
      "id": 1386,
      "name": "Строительство Тазалыка №2"
    }
  },
  {
    "id": 1417,
    "name": "3. Организовать охрану площадки",
    "description": "",
    "status": {
      "id": 1,
      "name": "Новая",
      "color": "#00b4b4",
      "isActive": true,
      "hasDeadline": true,
      "isAppliedIndividually": false,
      "texts": [
        {
          "lang": "Ru",
          "name": "Новая"
        },
        {
          "lang": "En",
          "name": "New"
        }
      ]
    },
    "assigner": {
      "id": "user:1",
      "name": "Константин Осипов"
    },
    "project": {
      "id": 1386,
      "name": "Строительство Тазалыка №2"
    }
  },
  {
    "id": 1418,
    "name": "2.4 Проводить еженедельные совещания с участниками проекта",
    "description": "",
    "status": {
      "id": 1,
      "name": "Новая",
      "color": "#00b4b4",
      "isActive": true,
      "hasDeadline": true,
      "isAppliedIndividually": false,
      "texts": [
        {
          "lang": "Ru",
          "name": "Новая"
        },
        {
          "lang": "En",
          "name": "New"
        }
      ]
    },
    "assigner": {
      "id": "user:1",
      "name": "Константин Осипов"
    },
    "project": {
      "id": 1386,
      "name": "Строительство Тазалыка №2"
    }
  },
  {
    "id": 1419,
    "name": "3.1 Провести тестирование и пуско-наладку инженерных систем",
    "description": "",
    "status": {
      "id": 1,
      "name": "Новая",
      "color": "#00b4b4",
      "isActive": true,
      "hasDeadline": true,
      "isAppliedIndividually": false,
      "texts": [
        {
          "lang": "Ru",
          "name": "Новая"
        },
        {
          "lang": "En",
          "name": "New"
        }
      ]
    },
    "assigner": {
      "id": "user:1",
      "name": "Константин Осипов"
    },
    "project": {
      "id": 1386,
      "name": "Строительство Тазалыка №2"
    }
  },
  {
    "id": 1420,
    "name": "3. Завершить и проанализировать проект",
    "description": "",
    "status": {
      "id": 1,
      "name": "Новая",
      "color": "#00b4b4",
      "isActive": true,
      "hasDeadline": true,
      "isAppliedIndividually": false,
      "texts": [
        {
          "lang": "Ru",
          "name": "Новая"
        },
        {
          "lang": "En",
          "name": "New"
        }
      ]
    },
    "assigner": {
      "id": "user:1",
      "name": "Константин Осипов"
    },
    "project": {
      "id": 1386,
      "name": "Строительство Тазалыка №2"
    }
  },
  {
    "id": 1421,
    "name": "2.1 Организовать технический надзор",
    "description": "",
    "status": {
      "id": 1,
      "name": "Новая",
      "color": "#00b4b4",
      "isActive": true,
      "hasDeadline": true,
      "isAppliedIndividually": false,
      "texts": [
        {
          "lang": "Ru",
          "name": "Новая"
        },
        {
          "lang": "En",
          "name": "New"
        }
      ]
    },
    "assigner": {
      "id": "user:1",
      "name": "Константин Осипов"
    },
    "project": {
      "id": 1386,
      "name": "Строительство Тазалыка №2"
    }
  },
  {
    "id": 1422,
    "name": "2.2 Собрать и подать документы на оформление/приобретение землепользования",
    "description": "",
    "status": {
      "id": 1,
      "name": "Новая",
      "color": "#00b4b4",
      "isActive": true,
      "hasDeadline": true,
      "isAppliedIndividually": false,
      "texts": [
        {
          "lang": "Ru",
          "name": "Новая"
        },
        {
          "lang": "En",
          "name": "New"
        }
      ]
    },
    "assigner": {
      "id": "user:1",
      "name": "Константин Осипов"
    },
    "project": {
      "id": 1386,
      "name": "Строительство Тазалыка №2"
    }
  },
  {
    "id": 1423,
    "name": "5.2 Провести земляные работы, вынести инженерные сети, подготовить фундамент",
    "description": "",
    "status": {
      "id": 1,
      "name": "Новая",
      "color": "#00b4b4",
      "isActive": true,
      "hasDeadline": true,
      "isAppliedIndividually": false,
      "texts": [
        {
          "lang": "Ru",
          "name": "Новая"
        },
        {
          "lang": "En",
          "name": "New"
        }
      ]
    },
    "assigner": {
      "id": "user:1",
      "name": "Константин Осипов"
    },
    "project": {
      "id": 1386,
      "name": "Строительство Тазалыка №2"
    }
  },
  {
    "id": 1424,
    "name": "2.1 Разработать и утвердить архитектурную концепцию с учетом градостроительных норм",
    "description": "",
    "status": {
      "id": 1,
      "name": "Новая",
      "color": "#00b4b4",
      "isActive": true,
      "hasDeadline": true,
      "isAppliedIndividually": false,
      "texts": [
        {
          "lang": "Ru",
          "name": "Новая"
        },
        {
          "lang": "En",
          "name": "New"
        }
      ]
    },
    "assigner": {
      "id": "user:1",
      "name": "Константин Осипов"
    },
    "project": {
      "id": 1386,
      "name": "Строительство Тазалыка №2"
    }
  },
  {
    "id": 1425,
    "name": "4. Запланировать и координировать работы",
    "description": "",
    "status": {
      "id": 1,
      "name": "Новая",
      "color": "#00b4b4",
      "isActive": true,
      "hasDeadline": true,
      "isAppliedIndividually": false,
      "texts": [
        {
          "lang": "Ru",
          "name": "Новая"
        },
        {
          "lang": "En",
          "name": "New"
        }
      ]
    },
    "assigner": {
      "id": "user:1",
      "name": "Константин Осипов"
    },
    "project": {
      "id": 1386,
      "name": "Строительство Тазалыка №2"
    }
  },
  {
    "id": 1426,
    "name": "1. Выполнить окончательную приёмку и ввести в эксплуатацию",
    "description": "",
    "status": {
      "id": 1,
      "name": "Новая",
      "color": "#00b4b4",
      "isActive": true,
      "hasDeadline": true,
      "isAppliedIndividually": false,
      "texts": [
        {
          "lang": "Ru",
          "name": "Новая"
        },
        {
          "lang": "En",
          "name": "New"
        }
      ]
    },
    "assigner": {
      "id": "user:1",
      "name": "Константин Осипов"
    },
    "project": {
      "id": 1386,
      "name": "Строительство Тазалыка №2"
    }
  },
  {
    "id": 1427,
    "name": "3.3 Закрыть административные и финансовые вопросы",
    "description": "",
    "status": {
      "id": 1,
      "name": "Новая",
      "color": "#00b4b4",
      "isActive": true,
      "hasDeadline": true,
      "isAppliedIndividually": false,
      "texts": [
        {
          "lang": "Ru",
          "name": "Новая"
        },
        {
          "lang": "En",
          "name": "New"
        }
      ]
    },
    "assigner": {
      "id": "user:1",
      "name": "Константин Осипов"
    },
    "project": {
      "id": 1386,
      "name": "Строительство Тазалыка №2"
    }
  },
  {
    "id": 1428,
    "name": "3.2 Устранить дефекты по результатам промежуточных осмотров",
    "description": "",
    "status": {
      "id": 1,
      "name": "Новая",
      "color": "#00b4b4",
      "isActive": true,
      "hasDeadline": true,
      "isAppliedIndividually": false,
      "texts": [
        {
          "lang": "Ru",
          "name": "Новая"
        },
        {
          "lang": "En",
          "name": "New"
        }
      ]
    },
    "assigner": {
      "id": "user:1",
      "name": "Константин Осипов"
    },
    "project": {
      "id": 1386,
      "name": "Строительство Тазалыка №2"
    }
  },
  {
    "id": 1429,
    "name": "4.2 Организовать снабжение и логистику",
    "description": "",
    "status": {
      "id": 1,
      "name": "Новая",
      "color": "#00b4b4",
      "isActive": true,
      "hasDeadline": true,
      "isAppliedIndividually": false,
      "texts": [
        {
          "lang": "Ru",
          "name": "Новая"
        },
        {
          "lang": "En",
          "name": "New"
        }
      ]
    },
    "assigner": {
      "id": "user:1",
      "name": "Константин Осипов"
    },
    "project": {
      "id": 1386,
      "name": "Строительство Тазалыка №2"
    }
  },
  {
    "id": 1430,
    "name": "1.2 Получить заключительные акты, сертификаты и согласования",
    "description": "",
    "status": {
      "id": 1,
      "name": "Новая",
      "color": "#00b4b4",
      "isActive": true,
      "hasDeadline": true,
      "isAppliedIndividually": false,
      "texts": [
        {
          "lang": "Ru",
          "name": "Новая"
        },
        {
          "lang": "En",
          "name": "New"
        }
      ]
    },
    "assigner": {
      "id": "user:1",
      "name": "Константин Осипов"
    },
    "project": {
      "id": 1386,
      "name": "Строительство Тазалыка №2"
    }
  },
  {
    "id": 1431,
    "name": "3.3 Подготовиться к итоговой приемке и вводу в эксплуатацию",
    "description": "",
    "status": {
      "id": 1,
      "name": "Новая",
      "color": "#00b4b4",
      "isActive": true,
      "hasDeadline": true,
      "isAppliedIndividually": false,
      "texts": [
        {
          "lang": "Ru",
          "name": "Новая"
        },
        {
          "lang": "En",
          "name": "New"
        }
      ]
    },
    "assigner": {
      "id": "user:1",
      "name": "Константин Осипов"
    },
    "project": {
      "id": 1386,
      "name": "Строительство Тазалыка №2"
    }
  },
  {
    "id": 1432,
    "name": "3.4 Сформировать бюджет проекта",
    "description": "",
    "status": {
      "id": 1,
      "name": "Новая",
      "color": "#00b4b4",
      "isActive": true,
      "hasDeadline": true,
      "isAppliedIndividually": false,
      "texts": [
        {
          "lang": "Ru",
          "name": "Новая"
        },
        {
          "lang": "En",
          "name": "New"
        }
      ]
    },
    "assigner": {
      "id": "user:1",
      "name": "Константин Осипов"
    },
    "project": {
      "id": 1386,
      "name": "Строительство Тазалыка №2"
    }
  },
  {
    "id": 1433,
